question,wrong_choices,correct_answer
"NASA’s Mars rover, __________ , has been exploring Mars since 2012.","Diversity, Serenity, Divinity","Curiosity"
"What is the largest artificial object in space?","AI powered robot, Parabolic aircraft, None of the above","ISS (International Space Station)"
"The ISS (International Space Station) orbits Earth about once every?","60 minutes at an altitude of about 400 km, 60 minutes at an altitude of about 500 km, 90 minutes at an altitude of about 500 km","90 minutes at an altitude of about 400 km"
"The solar wind creates a “bubble” around the solar system called?","Feliosphere, Seliosphere, Peliosphere","Heliosphere"
"The solar wind can reach speeds of up to?","600 km/s, 800 km/s, 650 km/s","700 km/s"
"Solar wind is caused by the high temperature and pressure in the sun’s which atmosphere?","Photosphere, Chromosphere, A and B","Corona"
"The solar wind is a stream of charged particles mostly?","electrons; flows out from the sun, protons; flows out from the sun, protons and electrons; revolves around the sun","protons and electrons; flows out from the sun"
"The Kuiper belt and Oort cloud were first proposed by?","Dutch astronomer Kuiper in 1950, Dutch astronomer Kuiper Oort in 1950, French astronomer Jan Oort and Kuiper in 1950","Dutch astronomer Jan Oort in 1950"
"Some objects from the Kuiper belt are classified as “plutoids” and include?","Pluto, Cris, and Yeres, Pluto, Bris, and Teres, Yeres, Teres, Ceres","Pluto, Eris, and Ceres"
"The Oort cloud is estimated to be about __________ AU away from the sun?","200,000, 300,000, 400,000","100,000"
"Which of the following is a region of the solar system even farther out than the Kuiper belt?","The Gort cloud, The Fort cloud, The Nort cloud","The Oort cloud"
"The Kuiper belt is a region of the solar system beyond?","Venus, Saturn, Earth","Neptune"
"Most asteroids orbit the sun in a region called the asteroid belt between?","Jupiter and Saturn, Mercury and Neptune, Venus and Uranus","Mars and Jupiter"
"Asteroids are made mostly of?","Rock, metal, ice and dust, Metal and gas, Metal, gas and rock","Rock and metal"
"Comets are often called what?","Dusty snowballs, Filthy snowballs, Impure snowballs","Dirty snowballs"
"As comets get close to the sun, they start to “melt” and release gas and dust. This gas and dust forms what?","“coma” that points away from the sun and a long tail around the comet’s nucleus, Only “coma” around the comet’s nucleus, Only a long tail that points away from the sun","“coma” around the comet’s nucleus and a long tail that points away from the sun"
"Comets are made mostly of ______________?","Dust and lights, Ice, dust and lights, All of the above","Ice and dust"
"Comets are made mostly of ice and dust. As comets get close to the sun, they start to “melt” and release what?","Steam and dust, Steam, gas and dust, None of the above","Gas and dust"
"The moon’s surface has been explored by how many astronauts?","10, 11, 13","12"
"The moon has a large, circular basin called _____________?","the Simerian Basin, the Inbrium Basin, Black Bowl Basin","the Imbrium Basin"
"Which one of the following is true?","The moon has both atmosphere and magnetic field, The moon has atmosphere but no magnetic field, The moon has magnetic field but no atmosphere","The moon has no atmosphere or magnetic field"
"The moon’s surface temperature varies from about ________ to _________ ?","– 172 degrees Celsius at night to 172 degrees Celsius during the day, Remains constant during day and night, – 170 degrees Celsius at night to 107 degrees Celsius during the day","– 173 degrees Celsius at night to 127 degrees Celsius during the day"
"In an atomic nucleus, neutrons and protons are held together by: ___________?","Gravitational forces, Coulombic forces, Magnetic forces","Exchange forces"
"The height at which atmospheric pressure declines by a factor of e (an irrational number equal to 2.71828) is called __________.","Average height (H), Mean height (H), Standard height (H)","Scale height (H)"
"Exosphere interacts with ___________ of Earth at roughly distance of 10,000 km.","Electrosphere, Spectrosphere, Echosphere","Magnetosphere"
"_________ contains ozone layer.","Thermosphere, Lithosphere, Stratosphere","Exosphere"
"__________ contains the ozone layer.","Troposphere, Mesosphere, Ionosphere","Stratosphere"
"__________ is the atmospheric layer wherein the weather occurs.","Stratosphere, Mesosphere, Thermosphere","Troposphere"
"Which is the largest organ in the human body?","Liver, Heart, Kidney","Skin"
"Which of the following is used as a lubricant?","Silica, Iron oxide, Diamond","Graphite"
"Which of the following was first to be discovered in the chromospheres of the sun?","Krypton, Xenon, Neon","Helium"
"The two elements that are frequently used for making transistors are :","Boron and aluminium, Iridium and Tungston, None of these","Silicon and Germanium"
"Permanent hardness of water can be removed by adding __________?","Chlorine, Bleaching powder, None of these","Washing soda"
"In fireworks,the green flame is produced because of __________?","Sodium, Mercury, Potassium","Barium"
"Lingxi-03, developed by Galaxy Space, was launched using a ___________ carrier rocket.","Long March-3D, Vertical March-3D, Orbital March-2D","Long March-2D"
"When in the part of its orbit closest to the Sun, Pluto has an atmosphere of nitrogen and methane similar to Triton’s, but what happens when it is farther from the Sun ?","These gases are not present, These gases are like plasma, These gases are volatile","These gases are frozen"
"Titan, a moon of __________ , and Triton, a moon of _________ , have atmospheres mainly of _________.","Saturn, Jupiter, Hydrogen, Uranus, Neptune, Nitrogen, Mars, Venus, Hydrogen","Saturn, Neptune, Nitrogen"
"The planet retains an atmosphere when?","Gravity is low and temperature of atmosphere is great, Gravity and temperature both are great, Gravity and temperature both are constant","Gravity is great and temperature of atmosphere is low"
"Atmospheric pressure is the force (per unit-area) perpendicular to a unit-area of planetary surface, as determined by _________.","Mass of vertical column of atmospheric gases, Mass of horizontal column of atmospheric gases, Mass of vertical and weight of horizontal of atmospheric gases","Weight of vertical column of atmospheric gases"
"___________ begins at 690 to 1,000 km from the surface, and extends to roughly 10,000 km.","Troposphere, Mesosphere, Stratosphere","Exosphere"
"Which of the following is true about Ionosphere?","Its density is lesser at short distances from planetary surface in morning and further decreases as ionosphere rises at night-time, thereby allowing a greater range of radio frequencies to travel greater distances, Its density is greater at long distances from planetary surface in daytime and further increases as ionosphere rises at night-time, thereby allowing a greater range of radio frequencies to travel greater distances, None of the above","Its density is greater at short distances from tplanetary surface in daytime and decreases as ionosphere rises at night-time, thereby allowing a greater range of radio frequencies to travel greater distances"
"Atmosphere is held in place by?","Pressure of the planetary body, Charge of the planetary body, Heat of the planetary body","Gravity of the planetary body"
"The thermosphere extends from an altitude of ________ to the base of ________ at ________?","75 km, Mesosphere, 670 km, 80 km, Ionosphere, 680 km, 90 km, Ozone Layer , 690 km","85 km, Exosphere, 690 km"
"_________ is the layer wherein most meteors are incinerated before reaching the surface.","Troposphere, Stratosphere, Ionosphere","Mesosphere"
"The mesosphere ranges from ________ to _________?","46 km to 85 km, 48 km to 85 km, 52 km to 85 km","50 km to 85 km"
"Stratosphere is the atmospheric layer that absorbs most of __________ that Earth receives from the Sun.","Infrared radiation, Ozone layer, Radio waves","Ultraviolet radiation"
"_________ is the atmospheric layer that absorbs most of the ultraviolet radiation that Earth receives from the Sun.","Troposphere, Mesosphere, Ionosphere","Stratosphere"
"Stratosphere is present at an altitude between _________.","17 km and 35 km, 18 km and 35 km, 19 km and 35 km","15 km and 35 km"
"_________ extends from the top of the troposphere to the bottom of the mesosphere.","Thermosphere, Ionosphere, None of the above","Stratosphere"
"The height of the troposphere varies between ____________.","7 km at equator and 17 km at poles, 18 km at equator and 8 km at poles, 8 km at equator and 18 km at poles","17 km at equator and 7 km at poles"
"____________ contains 75–80 % of the mass of the atmosphere.","Stratosphere, Mesosphere, Thermosphere","Troposphere"
"Troposphere extends from planetary surface to bottom of __________?","Mesosphere, Troposphere, Thermosphere","Stratosphere"
"__________ is the lowest layer of the atmosphere.","Stratosphere, Mesosphere, Thermosphere","Troposphere"
"The presence of ice in which region of the moon has been conclusively established?","Northern pole region, Equator, All of the above","Southern pole region"
"The Saturn V rocket that took Apollo 11 to the moon in 1969 stood tall?","364-feet, 365-feet, 366-feet","363-feet"
"The extremely cold temperatures in the polar region of moon mean that it can act as a kind of __________ where things do not undergo much change.","Light capsule, Meta capsule, Natural capsule","Time capsule"
"What is the 2nd closest galaxy to the Milky Way?","Andromeda, Messier 81, Whirlpool","Triangulum"
"LPG consists mainly of : ___________?","Methane,Ethane & Hexane, Ethane,Hexane &Nonane, All of these","Methane,Butane & Propane"
"The main constituent of Pearls are: ______________?","Calcium oxide &Ammonium Chloride, Aragonite & Conchiolin, None of these","Calcium Carbonate &Megnesium Carbonate"
"Water is a good solvent of ionic salts because:","It has a high specific heat, It has no colour, None of these","It has a high dipole moment"
"Which scientist is known as modern father of Astronomy ?","Einstein, Newton, Archimedes","Copernicus"
"What is the chemical name of Oil of Vitriol?","Hydrochloric Acid, Nitric Acid, Muriatic Acid","Sulphuric Acid"
"According to Quark theory, there are _________ elementary particles.","Three, Nine, Ten","Six"
"Which is the New & Most Important Culprit damaging the ozone Layer?","Carbon Dioxide, Chlorofluoro Carbons, Carbon Monoxide","Nitrous Oxide"
"Pluto is known as dwarf planet because which of the following reason/s:","It has negligible mass, It has not nearly round shaped, All of the above","It does not have always same neighbouring planet"
"Which of the following phenomena of light are involved in the formation of a rainbow?","Refraction, Dispersion, Total internal reflection","All of the above"
"How many major gases have been used in re​frig​er​a​tors since its invention?","2, 4, 5","3"
"Which planet looks reddish in the night sky ?","Jupiter, Saturn, MercurY","Mars"
"Pregnancy time period of “mice” is ___________?","2 weeks, 2.5 weeks, 4 weeks","3 weeks"
"The color of a sedimentary rock is often mostly determined by___________?","Zinc, Calcium, None of these","Iron"
"What colour is called magenta?","Black, White, Yellow","Reddish-Purple"
"Which of these is ‘escapism’?","an extreme sport, a vintage fasion style, a dangerous adventure","mental diversion from unpleasant or boring aspects of daily life"
"A Cheetah can accelerate to 100 kmph in just__________.","6 seconds, 9 seconds, 12 seconds","3 seconds"
"Aphasia is the inability to do what?","Walk, Study, Bath","Communicate"
"In radio, what does the FM stands for?","Frequency meter, Fiber modulation, Frequency Magnet","Frequency modulation"
"Carpology is a discipline devoted to the study of what?","Corbons, Cubes, Infertile soils","Seeds and fruits"
"Which insect can survive without a head for one or more weeks?","Ladybird, Bee, Termite","Cockroach"
"The term xerostomia refers to_________?","dry skin, dry nose, dry head","dry mouth"
"In the human body, the lungs remove which gas from the blood?","Nitrogen, Hydrogen, Argon","Carbon Dioxide"
"Where is the location of intermediate neurons?","Kidney, Spleen, Liver","Brain"
"What fear do people with haphephobia have?","fear of dogs, fear of helicopters, fear of houses","fear of touch"
"Natural Radioactivity was discovered by Becquerel in ____________?","1766, 1935, 2001","1896"
"The ‘Solar Corona’ mainly consists of?","Gases, Ice, Cosmic rays","Molten lava"
"Rainbow is seen after rain because of hanging molecules of water which act as __________?","Lens, Mirror, Slabs","Prism"
"A light year is a unit of ?","Time, Energy, Mass","distance"
"Blood sugar is measured in:","mmHg, PPM, Gram/Liter","mg/deciliter"
"Smoke is an solution of _________?","Solid in solid, Solid in liquid, Gas in gas","Solid in gas"
"Fog is an example of _________?","Gas in gas, Gas in liquid, Liquid in liquid","Liquid in Gas"
"The Blood Grouping Was Discovered by__________ ?","Robert Oppenheimer, Dr Hollerith, None of them","Karl Landsteiner"
"The optic nerve which is found in the human brain is also called ___________?","Mini nervous, Carnival nerve, Sustained nerve","Second cranial nerve"
"The frequency of ultrasound wave is typically?","Above 20,000 kHz, Below 20 kHz, Below 02 kHz","Above 20 kHz"
"What does A1C measure in the blood test?","total cholestrol, fructosamine, muscle strength","blood sugar level for three months"
"What time of day do most owls hunt?","Morning, Afternoon, Evening","Night"
"Kinetics is the study of________.","Force and energy, Friction, Heat and temperature","Motion and its causes"
"An optical instrument which is used measure the properties of visible light is called?","Microscope, Telescope, Oscilloscope","Spectroscope"
"Which of the following animal has blue blood?","Snail, Octopus, Spider","All of above"
"Who keeps blind snakes as their pets?","Woodcutters, Eagles, Parrots","Owls"
"_______ is called folic aci","Vitamin B1, Vitamin B6, Vitamin B12","Vitamin B9"
"Composition of Ozone layer?","O1, O2, O4","O3"
"What is the name of the chart with letters in multiple rows, used for an eye test ?","Maslow’s pyramid, Gantt Chart, Peptide Test","Snellen Chart"
"Which of the following will you use to remove rust stains on cloth?","Alcohol, Kerosene Oil, None of These","Oxalic Acid Solution"
"What is the main composition of the sun?","Oxygen and Ammonia, Hydrogen and Oxygen, Methane and Hydrogen","Hydrogen and Helium"
"Which of the followings planet can float on water?","Mars, Venus, None","Saturn"
"Which of the following is a rich source of Vitamin B-12?","Cashew nut, Apple, Watermelon","Milk"
"Where do the Prime Meridian and the equator intersect each other point?","Arabian Peninsula, Malacca Strait, All of These","Gulf of Guinea"
"How many coloumns in the modern Periodic Table?","17, 19, None of these.","18"
"How many rows in the modern Periodic Table?","5, 6, None of these.","7"
"The energy currency of the cell is called?","Fat, LEAD, None of These","ATP"
"The term ‘white coal’ is sometimes referred to which of the following?","Geothermal energy, Wind energy, Biomass energy","Hydroelectricity"
"Which of the following lens are useful in microscope?","Concave lens, Curved lens, None of These","Convex lens"
"What is the distance of the star Proxima Centauri from the planet Earth ________?","3.2 light years, 2.4 light years, 1.5 light years","4.2 light years"
"Who is the inventor of the first magnetic resonance imaging (MRI) machine?","Godfrey Hounsfieldv, Mattias Schleiden, Theodore Schwann","Raymond Damadian"
"Cancer that does not form a tumor.","metastatic breast cancer, lung cancer, bladder cancer","leukemia"
"Which metal is called “metal of hope”?","Titanium, Gold, Platinum","Uranium"
"How Many Megapixels is the Human Eye?","570, 560, None of These","576"
"The main factor for determining a region’s climate is ___________?","Temperature, Longitude, None of them","Latitude"
"The only non metal exists in liquid state is ___________?","Mercury, Phosphorus, Iodine","Bromine"
"At which temperature does bacteria die?","102F, 106F, None of These","149F"
"Which is the Coldest Planet ?","Earth, Venus, Mercury","Uranus"
"Elastic rebound theory explains:","formation of rocks, structure of solids, None of these","causes of earthquake"
"Pomology is the study of: _________?","Mind, Bones, Birds","Fruits"
"The SI unit of Dipole moment is __________?","Cm, Weber, Coulumb","Debye"
"Tetanus is a _________ infection.","Viral, Fungal, Parasitic","Bacterial"
"Parkinson is a disease of____________?","Eyes, Heart, Lungs","Brain"
"Chlorophyll contains _____metal.","Iron, Calcium, Potassium","Magnesium"
"Tuberculosis is a _________ infection?","Viral, Fungal, Parasitic","Bacterial"
"The distance between Earth and Sun is greatest during ____________?","Astronomical, Lopsided, Astronomi","Apehelion"
"As we go higher into the atmosphere, the air becomes?","Denser, Warmer, Visible","Thinner"
"Vaccination is synonymous with ___________ immunity?","Natural Active, Allergy, None of These","Artificial Active"
"Thanatology is the study of _________?","Careers, Being, Soul","Death"
"Nearest star to the sun is: ___________?","Alpha Scorpius, Beta Orionis, Vegetal","Proxima Centauri"
"_______ bacterial disease affects Eye?","Rickets, Osteoporosis, Gum disease","Trachoma"
"Deficiency of vitamin E in the human body causes __________?","Bone problem, Rickets, Osteoporosis","Muscle weakness and vision problem"
"A solar eclipse occurs when _________?","Venus between Earth and sun, Sun is between Earth and moon, Moon is between Earth and Neptune","Moon is between Earth and sun"
"_______ is the average distance between the Earth and the sun ?","Moon unit, Light unit, Solar unit","Astronomical unit"
"The correct age of solar system is approximately __________?","4.3 Billion years, 4.4 Billion years, None of these","4.5 Billion years"
"Which region of the Moon is known as Dark side?","Equator, North Pole, None of these","South Pole"
"Deficiency of vitamin “D” in human body can causes____?","Gum disease, Skin problem, Eye-sighted weakness","osteoporosis and fractures"
"What is the most abundant form of matter in the universe?","Liquid, Gas, Solid","Plasma"
"Bolometer measures: ____________?","Breadith of tree, Burning capacity, Bearing capacity","Heat radiation"
"The distance between the earth and the sun is smallest in the month of _________?","February, December, April","January"
"The chief constituents of gobar gas is_________?","Oxygen, Hydrogen, Carbon monoxide","Methane"
"Dr. James Watson discovered the structure of DNA in __________?","1955, 1957, 1857","1953"
"How Many Brains Does an Octopus Have?","7, 8, 6","9"
"Outer layer of the human skin is called __________?","Hypodermis, Dermis, Hemidermis","Epidermis"
"There are almost _______of nephrons in the each kidney in human body?","5 million, 3 million, 10 million","1 million"
"Which of the following is the strongest & longest bone of human body?","Stapes, Tibia, None of the above","Femur"
"Which of the following is the largest gland of the Human body _________?","Lungs, Skin, Gall Bladder","Liver"
"Water soluble Vitamins are _________?","A & D vitamins, A & K vitamins, B & K vitamins","B & C vitamins"
"Vitamins A,D,E & _______ are fat soluble .","Vitamin B, Vitamin C, AOT","Vitamin K"
"RBCs are also called as_______?","Leucocytes, Nucleotides, AOT","Erythrocytes"
"WBCs are also called as _________?","Lymphocytes, Nucleotides, Erythrocytes","Leukocytes"
"The percentage of blood cells in the Blood of human body is _________?","40%, 50%, 60%","45%"
"The percentage of plasma in human Blood is _________?","50%, 60%, 80%","55%"
"Mohus scale is used for to measure ____________?","Humidity, Pressure, Temperature","Hardness"
"Which of the following is not a Fat-soluble vitamin?","Vitamin A, Vitamin D, Vitamin E","Vitamin B"
"Which amongst the following cannot pass through vacuum?","Light, Radiation, None of These","Sound"
"Night vision is possible with the help of ___________?","Red light, Violet light, Ultra violet Light E. None of these","Infrared Rays"
"The respiratory problem common in smokers is______?","tuberculosis, Asthma, Cancer","Emphysema"
"Despite the fluctuation in human body temperature. The temperature of human body remains at _________?","35 °C, 42 °C, 54 °C","37 °C"
"A fathom is equal to ________feets?","5, 4, 3","6"
"What is a Geiger Counter used to measure?","Pressure, Water flow, None of these","Radioactivity"
"What is the name of newsly discovered galaxy which may be the earliest and most distant galaxy ever discovered in April 2022?","GN-z11, Milky way, None of these","HD1"
"Who is the Father of Genetics?","Alexendar, Darewin, Louis pasture","Gregor Mendel"
"Which animal can create the loudest sound among any living creature?","Donkey, Monkey, None of these","Humpback whales"
"Which one of the following is not a true fruit?","Grapes, dates, plum","Apple"
"Metal are highly ___________ ?","Electronegativity, Both of these, Neutral","Electropositive"
"What measurement scale is used to determine wind speed?","Richter Scale, Meter-second scale, None of these","Beaufort Scale"
"Earthquake waves travel faster in __________?","Flexibl rock, Air, Soil","Water"
"Activity of Brain is recorded by ____________?","ECG (Electrocardiogram), X-Ray, None of these","EEG (Electroencephalogram)"
"The second largest moon “titan” is belongs to which planet?","Uranus, Venus, Mercury","Saturn"
"Which planet of our solar system is name after a female?","Uranus, Saturn, Mercury","Venus"
"The winter solstice in the southern Hemisphere occurs on __________?","22 December, 23 September, 22 March","21 June"
"The Summer solstice in the Northern Hemisphere happens on: __________?","21 July, 22 December, 22 March","21 June"
"Which element has the third most % in human body?","Oxygen 65%, Calcium 75%, Carbon 18%","Hydrogen 10%"
"Which element has the second most % in human body?","Oxygen 65%, Calcium 75%, Hydrogen 10%","Carbon 18%"
"Which element has the most % in human body?","Calcium 75%, Hydrogen 10%, Carbon 18%","Oxygen 65%"
"A fresh egg when placed in salt water will __________ ?","sink and go to the bottom, sink but will not go to the bottom, Burst","Float"
"JAUNDICE is the disease of __________?","Heart, Lungs, Brain","Liver"
"Maximum biological damage is caused by ____________?","Alpha rays, Beta rays, Microwaves","Gamma rays"
"Which diagnostic scan gives some of the highest radiation doses in diagnostic radiography ?","Ultrasound, MRI, X-Ray","CT-Scan"
"The importance of perspiration is to ___________?","Eliminate body odours, Improve the general health, Open the pores in the skin","Regulate body temperature"
"Which medicine can be used to make urine red in colour?","isoniazir, iron capsule, Omeprazole","Rifampicin"
"Velometer is used to measure?","Rain, Wind pressure, Heat","Speed of Air"
"Water soluble vitamins are released by__________?","Sweat, Tears, Injections","Urine"
"Which hormone is necessary for the production of milk in the mother’s breast?","FSH, H., Oxytocin","prolactin"
"The spray bottles used as window or household cleaner or perfume spray works on: __________?","Capillary action, Pascal’s Law, Stoke’s Law","Bernoulli’s Principle"
"Selenology is the study of __________?","Stars, Galaxy, Planets.","Moon"
"1 Carat is equal to __________?","0.3 g, 0.4 g, 0.5 g","0.2 g"
"What is unit of Pressure?","Barr, Torr, Pascal","All of these"
"What divides the Earth into the Northern and the Southern Hemispheres?","Axis of rotation, North Pole, South Pole","Equator"
"Triple point of water is _________?","271 K, 272.2 K, None of these","273.16 K"
"Chili contain which vitamin?","Vitamin A, Vitamin B, None of these","Vitamin C"
"What is ‘Tokamak’ ?","An Israeli radar system, An American anti-missile system, A defence collaboration between Japan and South Korea","A device used in nuclear-fusion research for magnetic confinement of plasma"
"Stars in the sky appear to twinkle due to _________?","a series of reflections, a surface tension phenomenon, multiple diminishing brightness","a series of refractions"
"Nowadays Milk is not considered balanced diet because it is lacking in ___________?","Magnesium and Vitamin D, Iron and Vitamin B, calcium and vitamin C","Iron and Vitamin C"
"Nearest star to sun is: __________?","Alpha Scorpii, Beta Orionis, Vega","Proxima Centurai"
"Pure limestone is called _______?","Aluminum Oxide, Calcium Sulphate, None of these","Calcium Carbonate"
"A bird sitting on a high tension electric wire does not get electrocuted because:","Sit has high resistance, the body is earthed, its feet are good insulators","it does not form a closed path for the flow of current"
"The color which we see when our eyes are closed?","Black, Grey, None of these","Eigengrau"
"Which metal pollute the air of a big city?","Copper, Chromium, Cadmium","Lead"
"Potassium nitrate is used in__________?","Medicine, Salt, Glass","Fertilizer"
"The gases used in different types of welding would include:__________?","oxygen and hydrogen, oxygen, hydrogen, acetylene and nitrogen, oxygen, acetylene and argon","oxygen and acetylene"
"Which of the gas is not known as green house gas?","Methane, Nitrous oxide, Carbon dioxide","Hydrogen"
"Which of the following is a tissue?","Lungs, Kidney, pancreas","Blood"
"The chemical name of chalk is","Sodium nitrate, Zinc sulfate, Sulphuric acid","Calcium carbonate"
"1 tonne = _____ kg?","100, 400, 4000","1000"
"Main use of salt in diet is to : ___________?","ease the process of cooking, increase the taste, inclease solubility of food particles in water","produce small amount of hydrochloric acid required for digestion"
