question,wrong_choices,correct_answer
"What is the largest type of shark?","Hammerhead Shark, Tiger Shark, Bull Shark","Great White Shark"
"Which famous scientist formulated the laws of motion and universal gravitation?","Galileo Galilei, Albert Einstein, Nikola Tesla","Isaac Newton"
"Which planet is known for its beautiful rings?","Mars, Jupiter, Uranus","Saturn"
"Pedology is study of ___________?","Birds, Languages, None of these","Soils"
"Which gas is most commonly used in neon signs?","Argon, Krypton, Xenon","Neon"
"Which vitamin is primarily produced in the skin in response to sunlight?","Vitamin A, Vitamin C, Vitamin K","Vitamin D"
"The waves which are used for line of sight (LOS) communication are called:","Cable waves, Antenna waves, None of these","Space waves"
"In the structure of fiber, the light is guided through the core due to total internal:","Refraction, Diffraction, None of these","Reflection"
"Global winds towards western direction are known as:","Western winds, Reynolds wind, None of these","Trade winds"
"Which of the following source of energy is caused by uneven heating of earth’s surface?","Solar, Biomass, None of these","Wind"
"Most major Tsunamis are produced by earthquakes with hypocenters less than:","30 km, 50 km, None of these","40 km"
"Blue dwarfs’ and ‘Red giants’ respectively refer to:","Moons of Jupiter, Young star and Old star, None of these","Old star and Young star"
"Which of the following is a neutral particle ?","Alpha particle, Electron, Proton E. All of these","Neutron"
"Which of the following is a focus area of bacteriology?","Study of viruses, Study of fungi, Study of parasites","Structure, genetics, and ecology of bacteria"
"What is the study of bacteria called?","Virology, Mycology, Parasitology","Bacteriology"
"A chronometer meter measures __________ ?","Water waves, Color contrast, Sound waves","Time"
"Mars will be visible skimming south of which star in Gemini?","Castor, Sirius, Betelgeuse","Pollux"
"On ________ which date will the conjunction of Venus and Saturn occur?","January 20, January 23, January 24","January 22"
"Which of Saturn’s moons will be visible during this week, appearing brightest when west of Saturn?","Titan, Enceladus, Rhea","Iapetus"
"Pollination of flowers by birds is called:_________?","Aeverology, Ornithology, Polligramy","Ornithophily"
"What does HMPV stand for?","Human Mycoplasma Virus, Human Multipathogen Virus, Human Molecular Virus","Human Metapneumo virus"
"There are many different types of frozen water on Earth. Collectively, they are known as the: ___________?","Hydrosphere, Frigid Zone, Biosphere","Cryosphere"
"The blotting paper helps observe liquid by__________?","Surface Action, Viscosity, Boldness","Capillary Action"
"In the atmosphere, if the temperature is low then the pressure is _________?","High, Normal, All of these","Low"
"Nucleus of an atom was discovered by___________?","Goldstein, James Chadwick, J J Thomson","Rutherford"
"Primatology is the study of: _________?","Human Behavior, Animals and Plants, Forests","Primates"
"The molecular mass of Water molecule is __________?","16amu, 17amu, 20amu","18amu"
"Vertical columns in the periodic table of elements are called as__________?","Periods, Rows, Lanthanoids series","Groups"
"Paleontology is the study of: _____________?","Organic particles in the air, How bodily structures are put together in an organism, How living things interact with each other and their environment","Ancient Life and Fossils"
"Apple is rich in: ______________?","Fluorine, Calcium, Phosphorus","Iron"
"The Latin word of the name given to a human being Homo Sapiens, include the: __________?","Genus & Family, Family & Order, Genus & Class","Genus & Species"
"The Protein coat of virus is known as:","Plasmid, Capsule, Plastid","Capsid"
"Which one of the following is Voluntary Muscle?","Cardiac, Stomach, Vessels","Biceps"
"Hepatitis is caused by: ____________?","Protozoans, Algae, Fungi","Virus"
"The SI unit of charge is __________?","Ampere, Ohm, Volt","Coulomb"
"Dermatophagia is a ____ condition.","Physiological, Dermatological, Genital","Psychological"
"The largest artery in human body_______?","Subclavian artery, Brachial artery, None of these","Aorta"
"Deficiency of Vitamin __________ causes Sailors Disease in human?","Vitamin A, Vitamin K, Vitamin D","Vitamin C"
"Which of the following is the most stable element?","Uranium, Hydrogen, Oxygen","Lead"
"A device that converts mechanical energy into electric energy is called_______?","Motor., Transformer., Coil.","Generator."
"The blue colour of clear sky is due to_______________?","Reflection of light, Refraction of light, Diffraction of light","Dispersion of light"
"People living in high altitudes (like mountains) usually have a _________?","smaller number of Red Blood Cells, smaller number of White Blood Cells, larger number of White Blood Cells","larger number of Red Blood Cells"
"Copper is used in the production of___________?","Brick kilns, Children toys, Kitchen utilities","Electric wires"
"Element extracted from Sea water?","Beryllium, Aluminium, None of These","Magnesium"
"When water is filled in a bottle and is allowed to freeze, the bottle breaks because","Bottle contracts at freezing point, temperature outside the bottle is less than that inside the bottle., None of the above","Water expands on freezing"
"A tight-rope walker carries a long pole which he holds across his body. The purpose of this pole is to__________?","Prop him up if he falls, Spread out his weight and reduce the pressure on the rope, Add extra weight to keep the rope tightly stretched","To keep the Center of gravity always above vertically above the rope"
"The sky appears blue because the earth’s atmosphere __________?","Reflects blue light, Transmits blue light, Has actual blue cover","Scatters blue light"
"The property by virtue of which metals can be beaten into thin sheets is known as?","Ductility, Conductivity, Density","Malleability"
"Steering of a car involves?","A single force, Two forces acting in the same direction, Two forces acting along different lines and in opposite direction.","A pair of forces acting along the same line and in opposite direction"
"The approximate intensity level of the sound which can cause damage to the ear drum is?","20 dB, 60 dB, 160 dB","100 dB"
"Which one of the following is the main culprit in the thinning of Ozone layer in the earth’s stratosphere?","Carbon dioxide, Nitrogen oxides, Methane","Chlorofluorocarbons"
"Fuse wire is made of_____________?","63% lead and 37% tin, 63% tin and 37% aluminum, 63% lead and 37% aluminum","63% tin and 37% lead"
"What is the smallest unit of heredity?","Chromosomes, Nucleotides, none","Gene"
"The shape of the external ear is due to____________?","Fibrocartilage, Articular cartilage, none","Elastic cartilage"
"When a patient’s immune system becomes reactive to a drug, this is an example of?","Super infection, Drug resistance, none","Allergy"
"Which of these is not a region of the spinal cord?","Thoracic, Lumbar, none","Pelvic"
"The autonomic nervous system innervates all of these except?","Cardiac muscles, Smooth muscles, none","Skeletal muscles"
"The damage to the_________nerve could result in the defect of the eye movement:","Optic, Trigeminal, none","Abducens"
"Serum if blood plasma minus its?","Calcium ions, Globulins, none","Clotting proteins"
"Which of the following is not an enzyme?","Chemotrypsin, Pepsin, none","Secretin"
"It is impossible for a type of O+ baby to have a type of____________mother:","O-, O+, none","AB-"
"The number of electrons of a neutral atom is automatically known if one knows the?","Atomic weight, Number of orbitals, none","Atomic number"
"An area of microbiology that is concerned with the occurence of disease in human population is?","Immunology, Paracitology, none","Epidemiology"
"It is a secondary plant nutrient?","Nitrogen, Phosphorus, none","Sulphur"
"Vacuum tubes have been replaced by__________?","Conductors, Diodes, None of these","Transistors"
"Geiger-Muller counter is used to detect__________?","Neutrons, Photons, none","Protons"
"The severity of 2005 earthquake in Pakistan on Richter scale was ?","6.9, 7.1, none","7.6"
"The unit to measure the quantity of Ozone in atmosphere is?","Dalton, Cuolomb, none","Dobson"
"The Beta particles are fast moving___________?","Protons, Neutrons, None","Electrons"
"One of the following countries produces maximum energy from atomic reactors?","France, UK, none","USA"
"The alpha particles are compact clusters of______________?","Electron and Proton, Three protons and three Neutrons, None","Two Protons and two Neutrons"
"Atom is made up of____________different kinds of subatomic particles:","Two, Four, None","Three"
"He was the first scientist to prove that Planets move around the sun?","Archimedes, John Kepler, None","Galileo Galilei"
"Phosphorus is an essential component of one of the following biological molecules:","Amino acids, Carbohydrates, None","Nucleic acids"
"One of these scientists formulated basic laws of Geometry?","Archimedes, Aristotle, None","Pythagorus"
"The earth’s ___________ is divided into 15 major plates of various sizes","Mesosphere, Stratosphere, None","Lithosphere"
"UV light falls in the category of___________?","Ionizing Radiations, Visible light, None","Non Ionizing Radiation"
"Basha Dam is to be constructed on___________?","River Sutlaj, River Jhelum, River Chenab (On Indus River in Gilgit-Baltistan)","None"
"Anti Diuretic hormone is secreted by one of the following glands?","Pancreas, Thyroid, None","Pituitary"
"Equator passes through one of these countries___________?","Saudi Arabia, Italy, Japan","None"
"One of the following is a water soluble vitamin?","Vitamin A, Vitamin D, Vitamin K","None"
"Deuterium differs from Hydrogen in having:","Different atomic number but same atomic weight, Different atomic number and different atomic weight, None","Same atomic number and different atomic weight"
"Which month of calendar year can lack a new moon?","December, May, None","February"
"The chemical name of quartz is:","Stannous Oxide, Aluminium Oxide, None","Silicon Dioxide"
"The atmosphere of moon consists of______________?","90% Hydrogen, 10% Nitrogen, 80%Nitrogen, 20% Hydrogen, None","60% Nitrogen, 40%inert gases"
"The dominant phase of life cycle in these organism is haploid?","Bacteria, Protozoa, None","Mosses"
"Which group of animals has heterogametic females?","Domestic fowl, Rabbit, None","Earthworm"
"The biggest species of the cat family is___________?","Lion, Leopard, None","Tiger"
"The biggest planet in our solar system is___________?","Venus, Pluto, None","Jupiter"
"The sunlight can reach a depth of___________meters in the ocean","80, 120, None","200"
"The field of specialization of famous Muslim scientist Abu Usman Aljahiz was?","Botany, Astronomy, None","Zoology"
"Albatros is__________?","A beetle, A fruit, None","A sea bird"
"Who proposed this concept “All motion is relative”?","John Kepler, Galileo Galilie, None","Albert Einstein"
"Coulomb is the scientific unit to measure?","Velocity, Temperature, Mass","None OF These"
"An instrument to detect the purity of milk is____________?","Hygrometer, Manometer, Sonometer","Lactometer"
"The theory of Expanding Universe was first propounded by____________?","Einstein, Newton, Gahleo","Hubble"
"Water has maximum density at____________?","0°C, 4° K, 4.8°C","4°C"
"For being able to see three-dimensional pictures we have to use_________?","A binocular, A camera, An epidiascope","A stereoscope"
"A satellite moving round the earth with a uniform speed has____________?","An accelerated motion, No acceleration at all, Uneven acceleration","Uniform acceleration"
"Materials for rain-proof coats and tents owe their water proof properties to________?","Viscosity, Specific gravity, Elasticity","Surface tension"
"The absorption of ink by blotting paper involves__________?","Viscosity of ink, Diffusion of ink through the blotting, Siphon action","Capillary action phenomenon"
"Detergents dissolved in water help in cleaning clothes by_________?","Increasing the temperature of water, Reacting chemically with dirt, Dissolving dirt","Reducing the surface tension of water"
"In order to prevent the corrosion of iron pipes they are often coated with a layer of zinThis process is termed as____________?","Electroplating, Annealing, Vulcanization","Galvanization"
"The cracking sound heard when dry hair is combed with a hard rubber comb is due to_________?","The hair barging against the charged comb, The rubbing of the comb with the hair, None of the above","Small electric sparks"
"Scalding with steam is more severe than scalding by boiling water because_______?","Steam can penetrate the skin, Steam is at a higher temperature, Steam is at a higher pressure","Steam contains more energy than boiling water"
"Water is a highly effective coolant for a car engine because _________?","Water is good conductor of heat, Water boils at a comparatively high temperature, Evaporation of water produces lot of cooling","Water has very high specific heat capacity"
"A train goes past a railway station at a high speeA young boy standing on the edge of the platform is likely to __________?","Remain unaffected, Fall away from the train, Fall away from or towards the train depending upon the speed","Fall towards the train"
"Which one of the following sets of color combinations is added in color vision in TV’?","Orange, back and violet, White. red and yellow, Yellow, green and blue","Red, green and blue"
"A Fahrenheit thermometer indicates a temperature of ‘ 14°F. its corresponding reading on the Celsius scale will be _________?","– 2O°C, + 10°C, + 20°C","– 10°C"
"Lead ball falls through water more slowly than through air because __________?","The value of ‘g’ is less in water, Density of air is less than that of water, Of The surface tension of water","Of the viscous force in water"
"The rear view mirror of a motor vehicle is ________?","Concave, Plane, Biconcave","Convex"
"The primary function of the feathers in birds is to _________?","Provide insulation for preserving body heat, Make the body surface waterproof, impart coloration for species as well as sex recognition","Provide striking surface to the wings for flying"
"What is ‘Stealth Technology‘?","A device which when attached to an aircraft makes it invisible on the radar, A Technology by which it is possible for the aircraft’s to spy in the enemy air-space, A technology by using which paratroopers can be dropped stealthily behind the enemy columns.","A coating which reduces the visibility of an aircraft on radar"
"Bats can also fly in dark because they are capable of taking the help of _________?","Ultraviolet Waves, Electromagnetic Waves, Special Retina","Ultrasonic Waves"
"The Green House Effect is caused by an excess of ?","Carbon monoxide, Carbon tetrachloride, None of the above","Carbon dioxide"
"T.V. transmission cannot cover a very large area because","the strength of T.V. waves is very limited, picture cannot be transmitted clearly after a specific distance, the air is not a good conductor of light and sound/waves","the shape of the earth is spherical"
"The cow’s milk contains how much amount of water in terms of percentage?","60%, 65%, 72%","80%"
"Most of the ozone in the atmosphere is concentrated in the _____________?","Mesosphere, Troposphere, ionosphere","Stratosphere"
"An iceberg is floating in seHow much of its mass will remain above the surface of water?","One fifth, One fourth, One third","One tenth"
"The sun appears red at sunrise and sunset while it appears white at noon, because","Of refraction, It is cooler at sunrise and at sunset, Of diffraction leading to red end of the spectrum reaching the earth.","Of Scattering of light due to dust particles and air molecules."
"An astronaut inside a spacecraft is in a state of weightlessness. This implies that?","The mass of the astronaut is reduced to zero, Gravity inside the spacecraft ceases to act, The astronaut is outside the influence of the earth’s gravitational force","The astronaut and the spacecraft are both in a free-failing state"
"A lake starts freezing because of the cold atmosphere. It will first freeze","At the bottom, ln the middle pan, Uniformly throughout the water body","At the top surface"
"The beautiful color patterns exhibited by a peacock in its tail feathers are due to ?","Selective re ection of light, Sinterference of light, Natural colour pattern of feathers","Selective absorption of light"
"What is the average adult pulse rate?","140-150, 115-125, 60","72-80"
"When a person enters a dark room from bright light he is not able to see clearly for a little while because the?","Eye is unable to adjust itself immediately, Retina becomes insensitive momentarily, Distance between the lens and retina take time to adjust","Iris is unable to dilate the pupil immediately"
"Which part of the Camera is analogue to the retina in the human eye?","Lens, Aperture, Shutter","Film"
"Dolly is the name of the ?","First cloned monkey, First test-tube baby, First human fossil","First cloned sheep"
"The most important stimulant in tea leaves is?","Brucine, Phenylalanine, Theine","Caffeine"
"Dialysis is used for the treatment of__________?","Heart weakness, Brain diseases, None of these","Kidney failure"
"ECG is used for the diagnosis of aliments of ?","Brain, Kidneys, Lungs","Heart"
"Short-sightedness can be corrected by using ___________?","Convex lens, Convex-concave lens, Concave-convex lens","Concave lens"
"Trachoma is a disease of the___________?","Liver, Lungs, Kidneys","Eyes"
"Myopia is a disease connected with_________?","Ears, Lungs, Brain","Eyes"
"Leukemia is a disease of the___________?","Lungs, Skin, Nerves","Blood"
"Medulla oblongata is a part of human ___________?","Heart, Liver, Sex organ","Brain"
"Which of the following diseases is caused by virus?","Tuberculosis, Malaria, Cholera","Small pox"
"Malaria is a disease which effects the____________?","Heart, Lungs, Kidneys","Spleen"
"A person with which of the following blood groups can receive blood of any group?","A, B, O","AB"
"The average heartbeat per minute in a normal man is _________?","50, 80, 100","70"
"Which of the following vitamins promote healthy functioning of eyes in human beings?","Vitamin B, Vitamin C, Vitamin D","Vitamin A"
"Which of the following have maximum calorific value?","Carbohydrates, Proteins, Vitamins","Fats"
"Which gland in the human body is called the master gland?","Pancreas, Thyroid, Spleen","Pituitary"
"How many bones are there in a newly born infant?","206, 230, 280","300"
"Which is the largest gland in the human body?","Thyroid, Pancreas, None of these","Liver"
"A person of which of the following blood groups is called a universal donor?","AB, A, B","O"
"Which of the following glands secrete tears?","Pituitary, Thyroid, Pancreas","Lachrymal"
"The function of hemoglobin is____________?","Destruction of bacteria, Prevention of anemia, Utilization of energy","Transportation of oxygen"
"The main function of the kidney is ____________?","To control blood pressure, To control body temperature, To help in digestion of food","To remove waste product from the body"
"The main constituent of hemoglobin is___________?","Chlorine, Calcium, None of these","Iron"
"What is the main component of bones and teeth?","Calcium carbonate, Calcium sulphate, Calcium nitrate","Calcium phosphate"
"Tibia is a bone found in the ____________?","Skull, Arm, Face","Leg"
"The largest part of the human brain is ___________?","Medulla oblongata, Cerebellum, None of these","Cerebrum"
"How many bones are there in an adult human being?","210, 260, 300","206"
"Red blood corpuscles are formed in the____________?","Liver, Kidneys, Heart","Bone marrow"
"Total volume of blood in a normal adult human being is","3-4 liters, 8-10 liters, 10-12 liters","5-6 liters"
"Which of the following helps in clotting of blood?","Vitamin B1, Vitamin B2, Vitamin D","Vitamin K"
"What is the body temperature of a normal man?","81.1 °C, 98.6 °C, 21.7 °C","37.0 °C"
"In humans , most nutrient molecules are absorbed by the ?","Stomach, Liver, Large intestine E. None of these","Small intestine"
"Cobalt is a material which is ?","Not attracted by a magnet, not a magnet, Weakly attracted by a magnet E. None of these","Strongly attracted by a magnet"
"The instrument which i specially design for recording earth quake wave is called seismograph which measure earth quake waves on a ____________?","Diatonic scale, Fahrenheit Scale, Celsius Scale E. None of these","Richter scale"
"Myopia is a defect of Human eye. it can be corrected by using a lens called?","Convex lens, Cylindrical lens, Plano convex lens E. None of these","Concave lens"
"A body can escape the gravitational pull of the earth if it is thrown up with a velocity of?","25 miles per sec, 60 miles per sec, 10 miles per sec E. None of these","7 miles per sec"
"A nuclear reactor is a device used to carry out controlled nuclear reaction whereas GM counter is a device used to detect?","Current, Voltage, power E. None of these","Nuclear Radiation"
"Magnifying power of a simple microscope can be increased by ?","increasing focal length of the lens, Lens of large aperture, lens of short aperture E. None of these","Decreasing focal length of the lens"
"The deepest place on earth is ____________?","Trench, Mangrove, Groove E. None of these","Mariana Trench"
"Twinkling of stars is caused by ?","Reflection of light, Polarization of light, Interference of light E. None of these","refraction of light"
"Cusec is a unit of _________?","Area, Time, Distance","E. None of these"
"Lactometer is a type of Hydrometer which is used to measure the specific gravity of _________?","Honey, Water, olive oil E. None of these","Milk"
"The temperature of the dead body is_______________?","0 ‘C, 37 ‘, Room Temperature E. None of these","Temperature of the place where it is kept"
"German Silver is an alloy of___________?","Zn + Ni, Cu + Zn, Cu + Sn E. None of these","Cu + Ni"
"The Continent Antarctica lies at the__________?","North pole, middle of the earth, Equator E. None of these","South pole"
"Parsec is a unit of ___________?","Energy, Time, Power E. None of these","Distance"
"In a fission nuclear reaction , a heavy nucleus breaks up into smaller nuclei whereas in another nuclear reaction two or more than two possibly nuclei are fused to form a heavy nucleus This nuclear reaction is called ?","Chemical Reaction, Nuclear reaction, Fission nuclear reaction E. None of these","Fusion nuclear reaction"
"The principle used in radar is the same as that of Sonar. In radar we use radio waves ; whereas in sonar we use ?","red waves, Infrared waves, super sonic E. None of these","Ultrasonic"
"A six feet tall lady wants to see her full image in a plane mirror . The minimum length of the mirror will be ?","6 feet, 12 feet, 4 feet E. None of these","3 feet"
"When a ray of sunlight enters a dark room , its straight path become visible because of dust particles hanging in the air. It is because light is _________?","Transparent, Invisible, opaque E. None of these","Visible"
"It is possible to recognize a person in the dark by simply hearing his unique voice . It is because of the_______?","Frequency, Time period, Quality E. None of these","pitch"
"The echo (reflected sounwill be distinctly heard only at ordinary temperatures if the distance of the reflecting surfaces from the source of sound is at least ________?","1120 ft, 120 ft, 100 ft E. None of these","56 ft"
"In winter an iron pipe feel colder than a wooden window . This is because wood is_______?","Conductor, Semi- Conductor, Not a solid while iron is a solid E. None of these","Non-Conductor"
"Water is heated in a kettlE. The inside water is heated by convection. A person sitting near the fire receives heat by ________?","Conduction, Convection, Reflection E. None of these","Radiation"
"In a railway track, two rails are joined end to end with a gap tin between them because?","Steel can be saved, Accidents due to contraction in winter can be avoided, Air gaps are necessary for bearing the weight of running train E. All of these","Accidents due to expansion in summer can be avoided"
"Name the famous book of Ibn-Sina in which he discussed human physiology and medicine ?","Al-Masudi, New Renaissance, Tadhkira E. None of these","Al-Qanun"
"Animal which captures and readily kills living animals for its food is called___________?","Parasite, Scavenger, Mammal E. None of these","Predator"
"The fruits without seed, like banana, are called_____________?","Seedless fruits, Parthenogenesis fruits, placental fruits E. Organic fruits","Parthenocarpic fruits"
"Quartz crystal in quartz watches work on the principle called?","Photoelectric effect, Stark effect, Thermionic effect E. None of these","Piezo-electric effect"
"Oasis is associated with___________?","Glaciers, Islands, Volcanoes E. Fertile land","Desert"
"Yeast is used in making bread because it produces____________?","Sugar, Bacteria, Oxygen E. None of these","Carbon dioxide"
"The phenomenon of Aurora Borealis, the display of red and green lights in northern hemisphere is due to radiations from____________ ?","Troposphere, Mesosphere, Stratosphere E. None of these","Ionosphere"
"Ozone layer prevents ______________ radiation from entering the atmosphere?","Infra-red, X-rays, Gamma rays E. None of these","Ultraviolet"
"Which one of the following is a non-metallic mineral?","Manganese, Magnesium, Bauxite E. None of these","Gypsum"
"Sedimentary rocks are__________?","Hard, Rough, Brittle E. Volcanic","Porous"
"A moderator is used in nuclear reactor in order to ?","Accelerate the neutrons, Increase the number of elections, Decrease the number of electrons E. None of these","Slow down the speed of the neutrons"
