question,wrong_choices,correct_answer
"Speed of sound in water at 20 °C is___________?","1450 m/s, 1498 m/s, 1500+ m/s","1474 m/s"
"In thrombocytopenia condition, bone marrow makes?","Normal platelets, Too many platelets, Does not effect","Too few platelets"
"In Essential thrombocythemia (ET) condition, bone marrow makes?","Too few platelets, Normal platelets, Does not effect","Too many platelets"
"A normal platelets count range ?","1.5 lac – 4.5 lac platelets per liter bloo, 1.5 million – 4.5 million platelets per liter of bloo, 1.5 million – 4.5 million platelets per micro-liter of bloo","1.5 lac – 4.5 lac platelets per micro-liter of bloo"
"Which group of compounds constitute carbohydrates?","Sugar and proteins, Starch and proteins, None of these","Starch and sugar"
"Which of the following planets rotate from east to west on its exis?","Jupiter, Mars, Mercury, Saturn, Neptune, Earth","Venus, Uranus"
"Characteristic odour of garlic is due to?","A fluorine compoune, A chlorine compound, None of these","A sulphur compound"
"Which has highest fuel value?","Charcoal, Gasoline, None of these","Hydrogen"
"Which Harmone contain iodine?","Insulin, Adrenaline., None of these","Thyroxine"
"Ozone layer thickness is measured in____________?","Metre, Joule, Pounds","Dobson"
"Gland responsible for heightened emotions is?","Pituitary gland, Thoiroid gland, None of these","Adrenal gland"
"If the green leaves are placed under red light, their color will become________?","Green, Red, Blue","Black"
"Max plank is famous for his discovery of?","photon, both of these, None of these","Energy quanta"
"Unit of surface tension in cgs system is?","Pascal, N/m, None of these","Dyn/cm"
"Homologous means?","Same Chemical Numbers, Different Chemical Properties, Different Chemical Numbers","Same Chemical Properties"
"Unit of specific gravity is?","Pascal, Mass/volume, None of these","No unit"
"Which of the following is a transition element?","Cl, S, None of these","Cu"
"Melting Point of Tungsten is?","1000 C, 2000 C, 4000 C","3000 C"
"Sea water (Salt water) freezes at ?","Same temperature as fresh water., Slightly higher temperatures than fresh water., Sea water does not freeze","Slightly higher temperature than fresh water."
"Which of the following is cold current ?","Gulf Stream, Brazil, Kuroshio","Benguela"
"Who gave the idea of law of inertia?","Dalton, Bacon, Einstein","Galileo Galilei"
"The term ‘Geography’ was coined first time by a Greek scholar _________ in 234BC?","Herodotus, Thales of Miletus, Plato","Eratosthenes"
"There are ______ themes in geography.","Three, Four, Seven","Five"
"The earth surface & crust constantly evolving due to ?","Rotary cycle, Normal cycle, Change cycle","Rock cycle"
"Calcaneus bone in which part of human body?","Hand, Arm, Skull","Heel"
"Which type of climates of world has dry summer & wet winter ?","Western European type, Equatorial type, Tundra type","Mediterranean type"
"Tarsal bone is in the?","Hand, Arm, Leg","Foot"
"Sedimentary rocks are formed by natural process known as ?","Rejuvenation, Hydration, Peroxidation","Lithification"
"Which of the following is a positively charged particle emitted by a radioactive element?","Beta Rays, Gamma Rays, None of these","Alpha Rays"
"BRT stand for ?","Blue rapid Transport, Best road transportation, Best road Transit","Bus Rapid Transit"
"Atmospheric pressure decrease rapidly with altitude because the air becomes_______ ?","Colder, Rich in Ozone, Warmer","Less denser"
"Skin has ___________ layers?","One, Two, Four","Three"
"The red blood cells originate in the ____________?","Brain, Muscles, Ligaments","Bone Marrow"
"The fastest bird is the Peregrine Falcon, clocked at speeds of up to _____ miles per hour?","250, 260, 230","240"
"DNA is _____________?","Acetic Acid, Citric Acid, None of these","A class of nucleic acids"
"Who discovered the blood group of man?","Edward Jenner, Laren, William Harvey","Karl Landsteiner"
"All of the following foods lack vitamin C, except","Cheese, Rice, None of these","Milk"
"Most gases conduct electricity at:","Normal pressure, Very high pressure, None of these","Very low pressure"
"Which chamber of human heart pumps fully oxygenated blood to aorta and hence to the body:","Right Auricle, Left Auricle, Right Ventricle","Left Ventricle"
"Which product is obtained in the manufacture of soap from oils:","Sodium chloride, Sodium hydroxide, Fats","Glycerine"
"In bacteria mesosomes take the place of which one of the following?","Ribosome, Golgi bodies, None of these","Mitochondria"
"When did Amnesty International won the Noble Prize:","1917, 1967, 1987","1977"
"The brightest colour emitted by the sun is:","Violet, Green- Blue, Red","Yellow-Green"
"The chemical used as a fixer in photography is__________?","Sodium sulphate, Borax, Ammonium sulphate","Sodium thiosulphate"
"A blood alcohol level above ________ will often result in death:","0.10, 0.20, 0.30","0.41"
"Chromosomes first become visible during which phases of mitosis:","Prometaphase, Telophase, Metaphase","Prophase"
"Refraction of sound can occur in:","Water, Air, None of these","Both A & B"
"The frequency of a turning fork determined by a:","Magnetic tape, Modulator, Reed instrument","Sonometer"
"The group of minerals chemically containing hydrocarbons is_______?","Silicate group, Oxide group, Hydride group","Organic group"
"The subatomic particles arriving from outer space having high energy are called?","Protons, Electrons, None of the above","Cosmic rays"
"A definite area or a space where some thermodynamic process takes place is known as?","Thermodynamic cycle, Thermodynamic process, Thermodynamic law","Thermodynamic system"
"A moving object always possesses?","Potential Energy, Thermal energy, Magnetic energy","Kinetic Energy"
"Study of culture is called?","Odology, Ornithology, Psychology","Anthropology"
"A disease always has a______?","Cure, Germs, Patient","Cause"
"The time in which Earth completes its revolution around the Sun is________?","340 days, 325 days, 360 days","365.25 days"
"An Average Hummingbird’s heart rate per minute is __________.","500 times, 1000 times, more than 1000 times","more than 1200 times"
"What do we call when the sound of frequency will be below 20 Hz?","Audio sounds, Ultrasonic, Supersonics","Infrasonic"
"All of the following foods contain carbohydrates except.","Rice, Potato, Milk","Meat"
"Symptoms of vitamin b7 deficiency are known to ______________.","Pellagra, Muscle weakness, Xerophthalmia","Hair Loss"
"Smallpox was eradicated in 1970s. What was the ‘great pox’ which remains active?","Bubonic plague, Measles, None","Syphilis"
"Which one of the following is not a true snake________ ?","Blink snake, Sea snake, Tree snake","Glass snake"
"How many noses does an ant have?","One, Two, Three","None"
"Which of the following is called as Blue planet?","Mercury, Venus, Neptune","Earth"
"Deforestation will decrease?","Soil erosion, Landslides, Soil fertility","Rainfall"
"How many bones are present in face?","15, 20, 18","14"
"The movement of earth around sun brings ________?","Tornadoes, Rainfall, Earthquakes","Seasons"
"Safe moisture content for the storage of cereals is?","10%, 16%, 17%","14%"
"A point directly below the sesmic focus is?","Cleft, Incentre, Orthocentre","Epicentre"
"Golden rice has the highest quantity of______?","Vitamin B, Vitamin C, Vitamin K","Vitamin A"
"Study of Liver and its diseases is called?","Mycology, Angiology, Otology","Hepatology"
"The most pure form of carbon among these are?","Lampblack, Graphite, None of these","Anthracite"
"Which metal is extracted from sea water?","Potassium, Aluminum, None of these","Magnesium"
"A man presses more weight on earth at___?","Sitting position, Lying Position, None of these","Standing Position"
"Which of the following is not a donor atom?","Phosphorus, Antimony, Arsenic","Aluminum"
"Saccharine is made up of __________?","Phenol, Propane, None of these","Toluene"
"The lowest temperature ever recorded on the Earth is?","–86.2 °C, –83.2 °C, –92.2 °C","–89.2 °C"
"Bones Ash contain?","phosphoric sulphate, None of these","Calcium sulphate"
"Trachoma is the disease of the________ ?","Brain, Spinal cord, Larynx","Eye"
"PVC is obtained by the polymerisation of?","Propane, Styrene, None of these","Vinyl chloride"
"Which of the following is the major constituents of LPG?","methane, ethane, hydrogen","butane"
"What is the rank of the earth in the solar system in terms of size?","5th, 3rd, None of these","4th"
"Fisher unit is used to measure?","Protein content, Flour color, Damaged starch","Flour"
"Which colour of light is deviated least ________.","Blue, Violet, Green","Red"
"Endothermic reactions are those in which ________.","Heat is evolved, Temperature increases, Light is produced","Heat is absorbed"
"Which of the following is not a primary colour ________.","Red, Blue, Yellow","Green"
"Soil acidity is corrected by?","Proper irrigation, Adding sodium hydroxide, Application of fertilizers","Liming"
"The S. I. unit of refractive index is _______?","meter, cm, watt","no unit"
"Which of the following arguments for trade barriers offers potential benefits to consumers?","To protect industries from competition from low wage countries., To protect industries from dumping., To nurture infant industries by protecting them from cheaper imports.","To soften the fall of declining industries."
"During which process of energy exchange does cold air displace warmer air?","Radiation, Conduction, None of these","Convection"
"In general, good absorbents of electromagnetic radiation are also good___________?","Conductors, Insulators, Semi Conductors","Radiators"
"What method of energy transfer requires no medium for transfer?","Convection, Conduction, A and B both","Radiation"
"During which process does heat transfer occur because of density differences__________?","Radiation, Conduction, None of these","Convection"
"The process by which air flows from one location in the atmosphere to another is called __________?","Radiation, Conduction, Electromagnetic Induction","Convection"
"The number of facial bones in a human body ________?","15, 22, 26","14"
"Heat of sun reaches the earth by ___________?","Convection, Conduction, None of these","radiation"
"Heavy mechanical complex use a large amount of water for_________?","Freezing, Washing, Mixing","Cooling"
"What percentage of earth’s water supply is fresh water___________?","5%, 21%, None of these","3%"
"Percentage of water in an apple is__________?","90%, 66%, None of these","84%"
"Percentage of water in a tomato is__________?","90%, 47%, None of these","94%"
"Where would you find a Eustachian Tube?","In the Brain, In the Lung, In Stomach","In the Ear"
"Vitamin E reduces the requirement of _________ .","Iron, Zinc, Magnesium","Selenium"
"Scurvy is caused due to the deficiency of ___________?","Vitamin A, Vitamin D, None of these","Vitamin C"
"Permissible noise level at Residential area during night time is:","55 dB, 75 dB, 80 dB","45 dB"
"The radiant energy having lowest energy is?","gamma rays, UV rays, visible light","Radio waves"
"Who enunciated the laws of planetary motion?","Nicolaus Copernicus, Isaac Newton, Galile","Johannes Kepler"
"Potassium meta-bisulphite is used as a food preservative for?","Squash, Tomato Ketchup, Pickles","Fruit Juices"
"An edible underground stem is?","Sweet-potato, Sugarcane, Radish","Ginger"
"_________ is psychological study of values and moral principles?","Sociology, Idiology, Criminology","Axiology"
"Of the total number of genes inherited by a child:","more are from the father, more are from the mother, there is never a constant number from the parents","there are an equal number from each parent"
"Which of these fruits develop from an inflorescence?","Apple, Guava, Grape","Pineapple"
"The floral part that produces pollen grains is:","Sepal, Petal, Ovary","Anther"
"Which metal is non toxic in nature?","Silver, Iron, Copper","Gold"
"The Structure in a cell which contains the genes is called:","Genetics, Saliva, Marrow","Chromosome"
"In a normal human body, the total number of red blood cells is ________?","15 trillion, 20 trillion, 25 trillion","30 trillion"
"For seeing objects at the surface of water from a submarine under water, the instrument used is ________?","Telescope, Kaleidoscope, Spectroscope","Periscope"
"Escape velocity of a rocket fired from the earth towards the moon is a velocity to get rid of the _______?","Centripetal force due to the earth’s rotation, Pressure of the atmosphere, Moon’s gravitational pull","Earth’s gravitational pull"
"Frederick Sanger is a twice recipient of the Nobel Prize for ________?","Physics in 1956 and 1972, Physics in 1903 and Chemistry in 1911, Chemistry in 1954 and Peace in 1962","Chemistry in 1958 and 1980"
"Friction can be reduced by changing from _________?","Rolling to sliding, Dynamic to static, Potential energy to kinetic energy","Sliding to rolling"
"Gravity setting chambers are used in industries to remove ________?","NOx, SOx, CO","Suspended particulate matter"
"Exposure to sunlight helps a person improve his health because ________?","Resistance power increases, The infrared light kills bacteria in the body, The pigment cells in the skin get stimulated and produce a healthy tan","The ultraviolet rays convert skin oil into Vitamin"
"Galileo was an Italian astronomer who _________?","Developed the telescope, Discovered four satellites of Jupiter, Discovered that the movement of pendulum produces a regular time measurement","All of the above"
"“Father of Optics” is the title given to__________?","Ibn-e-Sina, Al-Kandi, Al-Biruni","Ibn-al-Haitham"
"What charge card, developed in 1950, was the first to be accepted nationally in the US?","Visa, Discover, MasterCharge","Diner’s Club"
"When were blue jeans invented in _________?","1900s, 1860s, 1850s","1870s"
"Which one of the following is not a plant product?","Caffeine, Nicotine, Piperine","Saccharin"
"Saffron is obtained from which among the following parts of the plant ________?","Anther, Stamen, Pollen","Stigma"
"What is the number of known crystalline phases of water ________?","4, 8, 17","18"
"Which of the following in human body is involved in controlling blood sugar level?","Pitutary glands, Hypothalamus, Spleen","Islets of Langerhans"
"Which one of the following clouds is found at the highest level in the atmospher?","Stratus, Cumulus, Stratocumulus","Cirrus"
"The most important function of perspiration is?","Get rid of body waste, Regulate body waste, Lubricate the skin","Regulate body temperature"
"Who was the first to measure the earth’s circumference?","Galileo, Copenicus, Ptolemy","Eratosthenes"
"The term “white coal” sometimes referred to which of the following?","Geothermal Electricity, Wind Energy, Biomass Energy","Hydroelectricity"
"The light rays used for eliminating bacteria?","X-rays, infrared rays, microwave radiation","ultra-violet radiation"
"What would you find in a Vivarium?","microorganisms, Humans, None of these","Animals"
"_______________ causes biomagnification problem in the Ecosystem.","Lead, Chromium, Copper","Mercury"
"The Microbes used in baking industry is ________?","Penicillin, Water, None of these","Yeast"
"The process in which seed grows in to a new plant is called ______?","Fertilization, Vernalization, None of these","Germination"
"The Earth behaves like a magnet with ______ poles?","Four, Three, None of these","Two"
"The _____ is the largest natural source of light?","Moon, Star, None of these","Sun"
"The Quantity of matter present in an object is its ________?","Density, Weight, None of these","Mass"
"Unit of force in (SI) is __________?","Meter, Kilogram, None of these","Newton"
"Persistance of vision is the principle behind?","Camera, Spectroscope, Periscope","Cinema"
"Gamma rays have greatest similarity with?","a-rays, b-rays, U.V.-rays","X-rays"
"Change of state form liquid to solid is _________?","Boiling, Evaporation, None of these","Freezing"
"________ it fills all the space avaliable.","Liquid, Solid, None of these","Gas"
"State of matter which has definite shape and volume is called __________?","Liquid, Gas, None of these","Solid"
"Boiling point of pure water is __________?","90’C, 97’C, None of these","100’C"
"Matter exists in______ states.","One, Five, None of these","Three"
"Which of the following are Biodegradable ___________?","Cans, Glass, None of these","Dead Plants"
"Which of the following are non-biodegradable materials ______?","Dead Animals, Bread, None of these","Plastics"
"The main cause of air pollution is __________?","Forests, Fertilizers, None of these","Burning Of Fuels"
"Seed Coat is also called _________?","Radical, Tegmen, None of these","Testa"
"All of these are benefits of bacteria except ______?","Decomposition, Nitrogen Fixation, None of these","Oxygen Production"
"In your body where is the Macula located?","Knee center of leg, Brain center of Cerebrum, None of these","Eye center of Retina"
"Which vegetable is also a flower __________?","Lady Finger, Tomato, None of these","Broccoli"
"In Astronomy, what are Pallas, Vesta and Davida?","Stars, Comets, None of these","Asteroids"
"Cotyledons are very Important because they ________?","Store Water, Store Air, None of these","Store Food"
"Hepatitis and Polio is caused by________?","Fungus, Moss, None of these","Virus"
"First antibiotic was extracted from a _________?","Bacteria, virus, None of these","Fungus"
"Microorganisms can only be seen with an equipment called ________?","Telescope, Spectroscope, None of these","Microscope"
"The quantity of matter in an object is its ________?","Force, Weight, None of these","Mass"
"Which one is non flowering plant _______?","Jasmine, Sun Flower, None of these","Moss"
"Classification of Animals and Plants on the basis on chromosome number is called________?","Ecology, Botany, None of these","Taxonomy"
"In an MRI machine, which one of the following is used?","Sound wave, ‘X’-ray, Ultra-sound wave","Magnetic wave"
"Electrostatic precipitator is used to control?","Water pollution, Solid waste, Noise pollution","Air pollution"
"Lambert’s law is related to?","Reflection, Refraction, Interference","Illumination"
"The atmospheric air is held to the Earth by?","winds, clouds, rotation of the Earth","gravity"
"Which type of reaction produces the most harmful radiation?","Fusion reaction, Chemical reaction, Photo-Chemical reaction","Fission reaction"
"The time period of a pendulum when taken to the Moon would?","remain the same, decrease, become zero","increase"
"The period of revolution of a geostationary satellite is?","365 days, 30 days, changing continuously","24 hours"
"The scientist who first sent electromagnetic waves to distant places is?","James Clerk Maxwell, Heinrich Hertz, John Logie Baird","Thomas Alva Edison"
"Male birds are ________ colorful than female birds.","Less, Equal, None of these","More"
"Atephobia is fear of _________?","Heights, Attitude, None of these","Imperfection"
"Pluviometer measures ___________?","Wind, Strength of Plywood, None of these","Rainfall"
"A transformer works on the principle of _______________?","Self induction, Generator, Inverter","Mutual induction"
"Intensity of gravitational field of earth is maximum at?","Equator, Center of earth, Surface","Poles"
"Angle of friction and angle of repose are?","not equal to each other, proportional to each other, None of these","equal to each other"
"How many kgs are in one ton?","707, 807, 607","907"
"Heat transfer horizontally within the atmosphere is called?","Conduction, Convection, Absorption","Advection"
"In which of the following processes is energy released ?","Photosynthesis, Ingestion, Absorption","Respiration"
"What is meant by intermediate goods and services?","Products which one firm buys off another and then uses up in its own products., All inputs bought by firms, including labor and raw materials., Imports.","The same as capital goods, such as plants, buildings, vehicles, and machinery."
"Which of the following principleis used to produce ‘low-temperatures’ ?","Super conductivity, Joule-Kelvin effect, Thermo-electric effect","Adiabatic demagneti-sation"
"The electronic device which is used as a switch or amplifier is called ?","Diode, Resistor, Transformer","Transistor"
"Which of the following is an example for cantilever beam?","Diving board, See-saw, Common balance","Bridge"
"Atomic power plant works on the principle of?","fusion, thermal combustion, combined effect of all the above three","fission"
"According to the theory of relativity, which of the following always remains constant ?","Length of an object, Time, Space","Velocity of light"
"Freezing point of water at Fahrenheit Scale is?","0 °F, 212 °F, -32 °F","32 °F"
"Which one of the following wavelengths of light is most effective in photosynthesis?","Green, Orange, Yellow","Blue"
"A state of stress caused by concern for the earth’s environment is called?","Eco-fear, Eco-depression, Eco-alarm","Eco-anxiety"
"The cause for the Tsunami, as deduced by the seismologists, is?","gravitational pull of the moon, low pressure trough in the ocean, sudden change in the monsoon wind","deformation of sea floor and vertical displacement of water"
"Velocity of sound in air does not change with the change of?","Temperature of air, Moisture content in air, Wind in the direction of propagation of sound","Pressure of air"
"The diagnosis of anthrax in cattle may be made by__________?","Spore staining, Quellung reaction., Mcyfaydean reaction","None of the above"
"The weakest of all fundamental forces is the ________________?","Electrostatic force, Magnetic force, Nuclear force","Gravitational force"
"The process involved in making soap is called?","hydrolysis, condensation, polymerisation","saponification"
"A boy sitting in an open car moving with the constant speed throws a ball straight up into the air. The ball falls _________?","in front of him, into his hand, by his side","behind him"
"The most distant human-made object sent into the space is?","Pioneer 10, Eris, New Horizon","Voyager 1"
"Which of the following circuit elements is used to ‘block’ DC in an electronic circuit ?","Resistances, Inductance, Diode","Capacitance"
"Which of the following celestial bodies contains abundant quantities of helium-3, a potential source of energy?","Earth, Venus, Saturn","Moon"
"An egg sinks in soft water but floats in a concentrated solution of salt because?","egg absorbs salt from the solution and expands, albumin dissolves in salt solution and egg becomes lighter, water has high surface tension","the density of salt solution exceeds the density of eggs"
"What is cVDPV2?","Corona Virus New variant, Type-II Cancer, Wild Poliovirus","Poliovirus Type-II"
"In a photocell light energy is converted into?","potential energy, chemical energy, heat energy","electrical energy"
"The type of mirrors used in the headlamp of cars is ____________?","Plane, Spherical convex, Cylindrical concave","Parabolic concave"
"We always see the same face of the moon, because?","It is smaller than the earth, It revolves on its axis in a direction opposite to that of the earth, It rotates at the same speed as the earth around the sun","It takes equal time for revolution around the earth and rotation on its own axis"
"Main Control System of our body is _____?","Brain, Heart, Lungs","Nervous System"
"Leach has ________ number of brains.","Zero, 36, None of these","32"
"How many moons does Saturn have?","7, 13, 79","82"
"SI unit of Illumination is ________?","Candela, Flux, None of these","Lux"
"What is depression rate in pakistan?","31, 32, 33","34"
"Which gas is commonly used in balloons and airships?","Hydrogen, Carbon, Chlorine","Helium"
"Which ocean is called “Ring of Fire”?","Indian Ocean, Atlantic Ocean, Antarctic Ocean","Pacific Ocean"
"How many pounds in a kg?","2.30, 2.40, 2.50","2.20"
"How many grams in a pound?","451, 455, 457","453"
"How many ounces in a pound?","10, 12, 14","16"
"Where is the dirtiest skin of our body is located?","Feet, Hands, None of these","Face"
"How many grams in an ounce?","20, 24, 32","28"
"Which body part gets older first?","Face, Feet, None of these","Hands"
"Which water will freeze first?","Cold, Both, None","Hot"
"How many ounces in a kg?","28, 30, 33","35"
"Which of the following is called smallest, shallowest and coldest ocean of the world?","Pacific Ocean, Indian Ocean, None of the above","Arctic Ocean"
"What does Angstrom measure?","Quantity, Speed, None of these","Length"
"Which of the following ocean is the least polluted ocean of the world?","Arctic Ocean, Indian Ocean, None of the above","South Pacific"
"Which planet in our solar system has the most gravity?","Mercury, Venus, Neptune","Jupiter"
"Which of the following ocean is the most polluted ocean of the world?","Indian Ocean, Arctic Ocean, None of the above","North Pacific Ocean"
"Smallest animal is _________?","Gorilla, Tiger, Cat","Skunk"
"Which of the following ocean is the warmest ocean of the world?","Arctic Ocean, North Pacific Ocean, None of the above","Indian Ocean"
"Which gas does a Photocopier machine produce?","carbon dioxide, Sulfur dioxide, None of these","Ozone"
"Which is the most abundant element in the atmosphere?","Hydrogen, Nickle, Oxygen","Nitrogen"
"What was the first planet to be discovered using a telescope?","Jupiter, Venus, Mercury","Uranus"
"Arthritis is a disease of ?","Lungs, Blood, Liver","Disorder of the Joints"
"A summary value calculated from population is called?","Sample, Statistic, Population","Parameter"
"Which Part of an egg contains Protein?","Yellow, Shell, None of these","White"
"How many number of milk teeth are in the human body?","16, 12, 22","20"
"Plasmids are most often found in:","Virus, Fungi, Viroid","Bacteria"
"Of the six noble gases in the periodic table, which is the lightest?","Nitrogen, Hydrogen, Oxygen","Helium"
