question,wrong_choices,correct_answer
"Lunar eclipse occurs on__________?","New Moon, Half Moon, Quarter Moon","Full Moon"
"Who invented the first battery?","Tim Berner, Rob Stothard, Georges Leclanche","Alessandro volta"
"Which are the only two elements on the periodic table that are liquid at room temperature?","Carbon and helium, Nitrogen and Hydrogen, Oxygen and Neon","Mercury and Bromine"
"What are the three basic units of measurement for the metric system?","Centimetre, kilograms and metric, Kilogram, mass and energy, Kelvin, cd and mole","Metre, litre and gramme"
"What has no charge, and is one of the fundamental particles making up an atom’s nucleus?","Electron, Proton, All of Above","Neutron"
"Who came up with three laws of motion?","Galileo, Albert Einstein, Hubble","Issac Newton"
"Diamonds are made up almost entirely of what element?","Helium, Methane, Nitrogen","Carbon"
"At what temperature are Celsius and Fahrenheit equal?","40 degree, -10 degree, 10 degree","-40 degree"
"Who is considered the “father of psychoanalysis?","Galileo, Aristotle, Fabrica","Sigmund Frend"
"What is the first element in the periodic table?","Helium, Nitrogen, Carbon","Hydrogen"
"The lens used in a simple microscope is____________?","Concave, Cylindrical, None","Convex"
"The image formed in a compound microscope is_____________?","erect, sometimes erect, sometimes inverted, none","inverted"
"what is anthracite?","Carbon, Ammonia, None of these","Hard coal"
"When Pluto was cast out from the list of Planets?","September 24, 2006, April 28, 2004, January 26, 2006","August 24, 2006"
"What is the chemical formula of Ozone?","H2O, C12, CH4","O3"
"‘Christian Friedrich Schönbein’ discovery is___________?","Radium, Cholorine, Neutron","Ozone"
"‘Satiety’ is the condition in which patient lacks?","Talk, Sleep, Walk","Eat"
"Scientific Name of Human is____________?","Mono sapiens, Bio sapiens, Cosmopolitan","Homo sapiens"
"Silver fish is the name of__________?","Fish, Bird, Mammal","Insect"
"Rearing of honey bees for honey production is called?","Sericulture, Viticulture, Bees culture","Apiculture"
"Sericulture is the study of which discipline ?","milk Production, honey production, forest timber production","silk production"
"Earthquakes occur most frequently at __________?","Plate surface, Ocean beds, All of the above","Plate boundaries"
"P Waves are also said to be __________ waves?","Side-side, Up-down, None of the above","Push-pull"
"In general, the most destructive earthquake waves are the __________ ?","P waves, S waves, All of the above","Surface waves"
"Place directly above focus on Earth’s surface is known as _________?","Strike, Comma, Origin","Epicenter"
"The point within the Earth where earthquakes originate is _________?","Comma, Origin, Epicenter","Rashid Mehmood"
"Magnitude of energy released by an earthquake is calculated using ________?","Earthquake scale, Seismic scale ., Temblor scale","C"
"The ability of the Eye to see in the dark, is due to the production of a purple pigment known as________?","Carotene, Rhodopsin, Iodopsin","Retinene"
"The brain of human adult weighs about_________?","1600 – 2000 gm, 500 – 800 gm, 100 – 200 gm","1200 – 1300 gm"
"What happens to a person who receives the wrong type of blood?","All the arteries constrict, All the arteries dialates, The spleen and lymphnodes deteriorate","The RBCs agglutinate"
"Animals living in the Tree trunks are known as___________?","Volant, Amphibious, Aquaticx","Arboreal"
"EEG records the activity of__________?","Heart, Lungs, Muscles","Brain"
"The toxicity of which of the following heavy metals leads to Liver cirrhosis?","Lead, Mercury, Zinc","Copper"
"Insufficient blood supply in human body is referred as___________?","Hyperemia, Hemostasia, Hemorrhage","Ischemia"
"What inspired reflecting road lights to be invented?","Car door reflecting mirrors, Sun light on steel posts on road sides, The sun light on the windshield","The light a cat’s eyes gave off on a fence"
"Cell or Tissue death within a living body is called as__________?","Neutrophilia, Nephrosis, Neoplasia","Necrosis"
"Which of the part of tongue bears cells for sour taste?","Front, Back, Middle","Sides"
"The carbon dioxide content in the air that we exhale is about?","9%, 15%, 16%","4%"
"Tetanus is caused by____________?","Virus, Bacteriophage, Salmonella","Clostridium"
"The metal, which is a constituent of vitamin B12 is____________?","Iron, Magnesium, Zinc","Cobalt"
"What “Enrico Fermi” invented?","X ray machine, Betatron, Cyclotron","Rashid Mehmood"
"The type of glass used in making lenses and prism is___________?","Pyrex glass, jena glass, Soft glass","Flintglass"
"Study of Soil is called__________?","Pedagogy, sociology, Demography","Pedology"
"Which Gas is included in Fry Chips Packets for safety?","Carbon dioxide, Oxygen, Hydrogen","Nitrogen gas"
"A reptile with a four-chambered heart is______________?","Snake, Turtle, Lizard","Crocodile"
"Which creature is the symbol of Medicine?","Cat, Lizard, None of these","Snake"
"Ombrophobia is fear of____________?","Snow, Smog, None of these","Rain"
"The Reason for a Swimming Pool to appear Less Deep than the actual depth is__________?","Light scattering, Reflection, Interference","Refraction"
"Nephology is study of_____________?","Knowledge, Rain, None","Clouds"
"Enology is the study of____________?","Digestion, Kidneys, None","Wine"
"Which statement about sound is true?","Sound can’t travel through glass, Sound can’t travel through water, Non of theses","Sound can’t travel through vacuum"
"The luster of diamond is due to_________?","Reflection, Refraction, None of these","Total internal reflection"
"The post-mortem examination of a body is called __________?","Etymology, Anatomy, None of these","autopsy"
"What are the primary colors of Pigment?","White, Black, Blue, Red, Orange, Blue, Red, Green, Blue","Red, Yellow, Blue"
"What are the primary colors of Light?","White, Black, Blue, Red, Yellow, Blue, Red, Orange, Blue","Red, Green, Blue"
"Which of the following is a ferromagnetic material ?","Tungsten, Aluminium, Copper","Nickel"
"Who invented the Hot Air Balloon?","Davy, Edison, Jarvik","Montgolfier"
"Very small time intervals are accurately measured by the___________?","Pabsars, White dwarfs, None of these","Atomic Clocks"
"“COTTON” is grown on ___________?","Red Soil, Regur Soil, Alluvial Sea","Black soil"
"Chemically finger nails are made up of ____________?","Carbohydrate, Fats, Starch","protein"
"P-waves is a term associated with__________?","Oceans, Wind, Rivers","Earthquakes"
"Which of the following is responsible for largest amount of oxygen on earth?","Peat bogs, Trees, None of these","Algae"
"The average kinetic energy of the molecules of a body determines?","heat, internal energy, none","temperature"
"Which metal is added to steel to make it stainless steel?","Aluminium, Carbon, Copper","Chromium"
"Name the branch of science which deals with the study of sound and sound waves?","Aeronautics, Aerostatics, Aetiology","Acoustics"
"Which of the following is not a waterborne disease?","Cholera, Amoebiasis, Typhoid","Influenza"
"Which of the following gases do plants and trees give out during photosynthesis?","Hydrogen, Nitrogen, Carbon dioxide","Oxygen"
"On which disease did Robert Koch work?","Cholera, Malaria, Diabetes","Tuberculosis"
"The sounds of which frequency are human beings most sensitive?","400 hertz, 20 hertz, 20000 hertz","5000 hertz"
"What is the common name for the drug acetyl salicylic acid?","Paracetamol, Analgin, Penicillin","Aspirin"
"Which of the following is affected by rickets in the human body?","Tissues, Muscles, Blood","Bones"
"In which part of the Plant does photosynthesis take place?","Flowers, Roots, Stem","Leaves"
"Who first measured the velocity of light?","Einstein, Newton, Galileo","Ole Roemer"
"Which vitamin is available to the human body through sun bathing?","Vitamin A, Vitamin K, Vitamin B12","Vitamin D"
"Which Organ is affected by trachoma?","Liver, Lungs, Brain","Eyes"
"Which of the following is not a mammal?","Cow, Goat, Whale","Fish"
"Which is the hardest substance in the human body?","Skull, Knee cap, Rib","Tooth enamel"
"Which natural element has the highest melting point?","Iron, Copper, Silver","Tungsten"
"In the treatment of which disease is dialysis used?","Ulcers, Heart failure, Brain tumour","Kidney failure"
"What causes mumps?","Fungus, Bacterium, Deficiency of vitamins","Virus"
"How many pairs of walking legs does a cockroach have?","One, Two, Four","Three"
"Who invented Logarithm Tables?","John Doe, John Harrison, John Douglas","John Napier"
"What is the range, in hertz, of the normal human hearing?","10 Hz to 10 kHz, 2000Hz, 40 Hz to 40 kHz","20 Hz to 20 kHz"
"Which liquid is used in an aneroid barometer?","Mercury, Alcohol, Water","None"
"A group of elephants is called___________?","ZEAL, MOB, TOWER","Herd"
"Which of the following is caused by a deficiency of iron in the diet?","Giotre, Scurvy, Rickets","Anaemia"
"Which of the following animals does not have nervous system?","Bat, Squirrel, Lizard","Sponges"
"Which lenses are used by people having short-sightedness?","Convex, Concavo-convex, Plain","Concave"
"Through which organ does a fish respire?","Nose, Lungs, Fins","Gills"
"Who first discovered how blood circulates in the human body?","Edward Jenner, Joseph Lister, Gregor Mendel","William Harvey"
"Inside which organ is the gallbladder located?","Pancreas, Kidney, Small intestine","Liver"
"Name the drugs which block the sensory nerves and prevent the patient from feeling pain?","Analgesics, Antibiotics, Antihistamines","Anaesthetics"
"The study of rearing fine and intelligent human beings through genetics is called__________?","Biotechnology, Cloning, Geneology","Eugenics"
"Study of energy production in living bodies is called_________?","Biology, Biomechanics, Aerodynamics","Bioenergetics"
"Analytical solutions to Quadratic equations were introduced by__________?","Al-haitham, IsasacNewton, Pythagoras","Al-Khawarzimi"
"Calculus was invented by________?","Al-khawarzimi, Pythagoras, Al.kindi","IsaaC Newton"
"Science is derived from Latin word “scientia” which means_________?","Reasoning, Logic, Life","Knowledge"
"At what temperature does silver melt?","275 °C, 327 °C, 100 °C","961.8 °C"
"The reaction between methane and chlorine in diffused sunlight is__________?","Oxidation, Reduction, Polymerisation","Radical substitution"
"Which of the following in the human body is affected by leukemia?","Lungs, Eyes, Nerves","Blood"
"Human bone does not contain_________?","Calcium, Chondroitin sulfate, phosphate","Boron"
"The term PVC used in the plastic industry stands for______________?","Phosphavinyl chloride, Phosphor vanadiu chloride, Polyvinyl carbobate","Polyvinyl chloride"
"Oil of vitriol is_________?","Nitric acid, Hydrochloric acid, Phosphoric acid","Sulfuric acid"
"Calcium sulphate is known as__________?","Epsom salt, Blue vitriol, Potash alum","Gypsum salt"
"Epsom salt is chemically known as_________?","Copper Sulfate, Ferrous Sulfate, None of these","Magnesium Sulfate"
"The element used in lead pencils is__________?","Zinc, Lead, Tin","Carbon"
"The alcohol used in the preparation of dynamite is________?","ethyl alcohol, glycol, methyl alcohol","glycerol"
"Air contains maximum amount of__________?","oxygen, hydrogen, carbon dioxide","nitrogen"
"First Atomic theory was proposed by?","E.Rutherford, De Broglie, I.Mendeleef","John Dalton"
"Ruby is an oxide of__________?","silver, gold, platinum","aluminium oxide"
"Bauxite is an ore of_________?","copper, zinc, iron","aluminium"
"Who created periodic table?","Faraday, Lavoisier, Arrhenius","Mendeleev"
"Earth rotates the sun in___________?","24 hours, 23 hours 57 min 9 sec, Non of above","23 hours 56 min 4 sec"
"Air Conditioning Controls:___________?","Circulation of the Air, Humidity, Temperature","All of The Above"
"The 2018 Nobel Prize in Physiology or Medicine has been awarded jointly to James P Allison and Tasuku Honjo for their discovery of which cancer?","Chemotherapy, Radiation, Surgery","Immunotherapy"
"Which of the following is the most toxic gas?","Carbon dioxide, Nitrogen, Hydrogen","Carbon monoxide"
"Radon is___________?","germon radio, artificial fibre, an explosive","radio active gas"
"Which one of the following gases is readily soluble in water at room temperature?","Chlorine, Nitrogen, Carbon dioxide","Ammonia"
"Bleaching powder contains___________?","Nitrogen, Iodine, Bromine","Chlorine"
"Bleaching action of chlorine is by________?","Reduction, Decomposition, Hydrolysis","Oxidation"
"Which is the heaviest metal?","Iron, Mercury, Nickel","Osmium"
"What is a mixture of Potassium Nitrate Powdered Charcoal and Sulphur called?","Paint, Glass, Cement","Gun Powder"
"Nail polish remover contains___________?","Benzene, Acetic acid, Petroleum ether","Acetone"
"Which one of the following is the softest?","iron, aluminium, lithium","sodium"
"Which variety of glass is heat resistant?","Bottle glass, Flint glass, Hard glass","Pyrex glass"
"Which synthetic fibre is known as artificial Silk?","Nylon, Cotton, Terylene","Rayon"
"The alloy of aluminium used for making magnet is_________?","Duralumin, Y-Alloy, Aluminium bronze","Alnico"
"Which type of motions are present in solid?","translational, rotational, all of these","vibrational"
"Which blood group is universal receiver?","Group A, Group B, GROUP O","Group AB"
"Which Planet is Called Great Red Spot?","Neptune, Mars, Mercury","Jupiter"
"Which of the following regulates the Metabolism Of Sugar?","Thyroid, Glucose, None of These","Insulin"
"Saliva contains__________?","Bite, Trypsin, None of these","Amylases"
"One Torr is equivalent to how many mm of Mercury?","10 mm, 100 mm, 0.1 mm","1 mm"
"What Color does chlorophyll not absorb?","Red, Blue, Yellow","Green"
"Sound travels_______ in solid materials then liquid?","Constant, Slowest, None of these","Fastest"
"What amount of fats give energy of 9.3 K Calories?","0.5 gram, 2.0 gram, 4.1 gram","1.0 gram"
"One gram of carbohydrates give energy of the amount?","2 K Calories, 6.3 K Calories, 8.0 K Calories","4.1 K Calories"
"The muscles, tissues and blood all are made up of____________?","Carbohydrate, Vitamins, Fats","Proteins"
"A man can survive without food for at least?","Two month, Three month, Four month","One month"
"The human blood is divided into__________ groups?","Two groups, Three groups, Five groups","Four groups"
"For water purification, we use?","Bromine, Plants, Young man","Chlorine"
"In the electricity meter the digit to the extreme right is___________?","1/5th of the unit, 1/100 of the unit, 1/1000th of the unit","1/10th of the unit"
"Units of electricity consumed by 2500 watt air-conditioner in one hour are_________?","25 units, 2.25 units, 0.25 units","2.5 units"
"According to the definition of 1 KWh, a 100 watt bulb consumes one unit of electricity in_________?","2 hours, 5 hours, 8 hours","10 hours"
"The large plates of solar pannels are painted?","Red, White, Yellow","Black"
"What is used in making of alloys?","Gypsum, Granite, Lime-stone","Chromium"
"The major part of natural gas, petroleum and coal consists of?","Carbon, Chlorine, CFC","Methane"
"The amount of energy in wheat is__________?","100 K Calories/100 gram, 245 K Calories/100 gram, 490 K Calories/100 gram","348 K Calories/100 gram"
"All forms of energy that we use are ultimately transformed into__________?","Electrical Energy, Light Energy, Chemical Energy","Heat Energy"
"In which system of units, gas bills are charged?","SI, CGS, CNG","BTU"
"In BTU system, one BTU is equal to__________?","2055 Joule, 1155 Joule, 2155 Joule","1055 Joule"
"The second most abundant metal found in the earth’s crust is_____________?","Aluminium, Calcium, Sodium","Silicon"
"The gases which are used by drivers as an artificial atmosphere are helium and_____________?","Nitrogen, Neon, Carbon monoxide","Oxygen"
"Air contains volume of carbon dioxide approximately?","3%, 33%, 0.3%","0.03%"
"Nitrogen occurs in plant and animals in the form of ___________?","Minerals, Fats, Carbohydrates","Proteins"
"As the temperature of ice rises, the ice melts and its density?","Decreases, Remain constant, Increases upto 10C","Increases"
"In blood, the percentage of water is___________?","75%, 85%, 95%","90%"
"Coke is made by heating coal in the absence of air at__________?","700 °C, 900 °C, 1700 °C","1300 °C"
"Why are soft drink made with chilled water rather than water at room temperature?","Ingredients dissolve better in chilled water, Chilled water enhances the taste, Chilled water is more hygienic","Chilled water attracts more carbon dioxide"
"In an oil lamp, the oil rises up in the wick due to?","Atmospheric pressure, Viscosity of oil, Change in temperature","Capillary action"
"Heating element of an electric heater is made up of___________?","Tungsten, Graphite, Chromium","Nichrome"
"During a total solar eclipse there is most likely to be_____________?","An increase in the rate of photosynthesis, A decrease in the rate of respiration, No effect on either photosynthesis or respiration","A decrease in the rate of photosynthesis"
"A tight-rope walker carries a long pole which he holds across his body. The purpose of this pole is to____________?","Prop him up if he falls, Spread out his weight and reduce the pressure on the rope, Add extra weight to keep the rope tightly stretched","To keep the centre of gravity always vertically above the rope"
"A man is standing on a weighing machine in a lift which is moving. The weighing machine will slow MINIMUM reading when, the lift is moving?","Upward with uniform speed, Downward with uniform acceleration, None of these","In a free fall due to failure of the lift mechanism"
"A slow-running pendulum clock can be speeded up by_______________?","Increasing the length of the rod, Increasing the weight of the bob, Reducing the weight of the bob","Reducing the length of the rod"
"The major component of honey is_________?","Glucose, Surcose, Maltose","Fructose"
"If there is no capillarity?","It would be impossible to use a kerosene lamp, The blotting paper would fail to function, There would have been no plants on earth","All of above"
"Which term describes the emission of light by a living organism?","Natural light, Illumination, Mimicry","Bioluminescence"
"What is the symbol of Gold?","Ag, S, None","Au"
"Which is the hottest planet in our Solar system?","Neptune, Mars, None of these","Venus"
"Vitamin B is found in__________?","Sea Foods, Fruits and Vegetables, None of these","Seeds"
"Vitamin C is found in_________?","Sea Food, Seeds, None of these","Fruits and Vegetables"
"For being able to see three-dimensional pictures we have to use___________?","A binocular, A camera, A stereoscope","A epidiascope"
"Material for rain-proof coats and tents owe their water proof properties to ________?","Viscosity, Specific gravity, Elasticity","Surface tension"
"Most of the ozone in the atmosphere is concentrated in the____________?","Mesosphere, Troposphere, Ionosphere","Stratosphere"
"What is the world’s warmest Sea?","Mediterranean Sea, Caspian Sea, Arabian Sea","Red Sea"
"What is the warmest Ocean?","Pacific Ocean, Atlantic Ocean, Arctic Ocean","Indian Ocean"
"What is the name of the branch of the science that studies the ocean?","Algology, Phology, Orintology","Oceanography"
"The lowest region of the earth’s atmosphere comes between the earth and stratosphere. what is this region’s name?","Ionosphere, Stratosphere, Mesosphere","Troposphere"
"The study of the weather is called____________?","Weatherology, Ecology, Geology","Meteorology"
"How many time zones are there in the world?","22, 12, 16","24"
"What natural phenomena are measured by the Richter Scale?","Volcanoes, Typhoons, Tsunami","Earth quacks"
"What melted rock eventually becomes lava?","Iron, Metals, Coal","Magma"
"What prevents the earth’s atmosphere from drifting away into space?","Ozone layer, Troposphere, Ecosystem","Gravity"
"Tocopherol is the chemical name of which vitamin?","vitamin C, vitamin D, vitamin A","vitamin E"
"Iodised salts contains the iodine salts of which metal?","Iodine, Sodium Chloride, Chlorine","Potassium"
"What is the name of the biggest part of human brain?","Cerebellum, Brainstem, Pituitary","Cerebrum"
"The psychological test of human emotions and personality, using inkblots, is formally known as what?","Nervous, Renal, All of above E. None of these","Rorschach"
"What is the rarest blood type in humans?","O-, O+, AB+","AB-"
"Who is the founder of solar system?","Newton, Galileo, Kepler","Copernicus"
"A Vegetable containing sulphur is____________?","Potato","ZAHID LAKHO"
"When we sleeps blood pressure_____________?","Increases, Remain constant, None of these","Decreases"
"How many rows and columns are in the modern Periodic Table?","12 columns and 9 rows, 7 columns and 18 rows, 25 columns and 15 rows","18 columns and 7 rows"
"What are rows in Periodic table called?","Group, Verticals, Perpendiculars","Period"
"What are Columns in Periodic table called?","Period, Verticals, Perpendiculars","Group"
"Which one is Natural Satellite?","Sun, Venus, Mercury","Moon"
"Summer solstice means__________?","longest night, smallest day, none of these","longest day"
"Oncology is the Study of__________?","Onions, Origins, Diseases","Cancer"
"How many moons does Neptune have?","63, 12, 19","14"
"Winter Solstice means____________?","longest day, smallest night, smallest day","longest night"
"How many moons does Uranus have?","15, 12, 45","27"
"What do you understand by disease “Insomnia”?","Color blindness, Depression, Hypertension","Inability to sleep"
"Frog Heart has how many chambers?","2, 4, 5","3"
"Which of the following is used in Pencils?","Silicon, Charcoal, Phosphorous","Graphite"
"Which of the following is a Non Metal that remains Liquid at room temperature?","Phosphorous, Chlorine, Helium","Bromine"
"Which Part of the Brain Regulates Body Temperature?","cerebellum, cerebrum, medulla","hypothalamus"
"Who is Considered as Father of Botany?","Aristotle, Gregor Joghn Mandle, Corlous Linnaeous","Theophrastus"
"In Eye donation, which part of the eye used?","Retina, Iris, Optic nerve","Cornea"
"Inhaled air passes through which of the following in the last?","Larynx, Pharynx, Trachea E. None of these","Bronchiole"
"It is observed that the total pressure exerted by air on the man of average size is around 14.7 lb wt. per square inch. But the man feels quite comfortable,. It is because of__________?","of the height of a man, of gravity, Earth pulls the man upward E. None of these","An equal and opposite pressure acts from inside"
"The Sun produces most of its energy by_____________?","nuclear fission, Burning hydrogen, None of these","Nuclear fusion"
"Primary cosmic rays are composed largely of very fast__________?","Neutrons, Electrons, Gamma rays","Protons"
"The time taken by Sun to revolve around the center of our galaxy is___________?","150 million years, 300 millon years, 350 millon years","250 million years"
"The average length of the kidney of a man is about?","7cm to 8cm, 8cm to 10 cm, 13cm to 16cm","10cm to 13 cm"
"In human osmoregulation takes place by___________?","Liver, Spleen, Lungs","Kidney"
"CT Scan stand for__________?","Computer Topography Scan, Computed Topography Scan, Computer Tomography Scan","Computed Tomography Scan"
"What is the average weight of Human Heart?","350 gram, 400 gram, 450 gram","300 gram"
"If you have “caries” then which doctor you have consult?","Dermatologist, Orthopaedist, Nurologist","Dentist"
"For which one of the following is the density maximum?","Ice, Benzene, Chloroform","Water"
"Which one of the following is also called Stranger Gas?","Neon, Argon, Nitrous oxide","Xenon"
"Which of the following is the hardest substance?","Copper, Iron, Silicon","Diamond"
"Pressure is measured by_________?","Voltmeter, Lactometer, Ammeter","barometer"
"Humans can hear in the range of ______ to _______Hertz (Hz).?","10 Hz to 10,000 Hz., 30 Hz to 30,000 Hz., 40 Hz to 40,000 Hz.","20 Hz to 20,000 Hz."
"Adult human brain is about_________% of the total body weight.","3%, 7%, 8%","2%"
"Which blood cells are called ‘Soldiers’ of the body?","Platelets, Red Blood Cells, None of the above","White Blood Cells"
"In Fishes excretory Product is__________?","Nitrogen, Uria, Carbon dioxide","Ammonia"
"What is the weight of the average human brain?","1.4 to 1.8 Kg, 2.1 to 2.8 Kg, 3.1 to 3.4 Kg","1.2 to 1.4 Kg"
"Telephone was invented by__________?","Vint Cerf, Charles Babbage, Edison","Alexander Graham Bell"
"The Sun is at an average distance of about________ million kilometers away from Earth?","100 million, 200 million, 250 million","150 million"
"UPS is now widely use in households. What does UPS stands for ?","Uniform Power Storage, Universal Product Support, Under Panel Storage","Uninterruptible Power Supply"
"Which rays are trapped in our galaxy by magnetic waves?","Alpha rays, Gamma rays, None of these","Cosmic rays"
"According to Einsteins general theory of relativity the universe:________________?","Must be expanding, Must be contracting, Must be neither expanding nor contracting","Must be either expanding or contracting"
"There is no connection of supernova explosion with___________?","Cosmic rays, Pulsars, The formation of heavy elements","Quasars"
"Echo is a ___________ of sound?","Refraction, Interference, None","Reflection"
"Which stone floats on water?","Lime stone, Basalt stone, Quartzite stone","Pumice stone"
"According to many, including the Guinness Book of World Record,________is the world’s rarest mineral?","Benitoite, Jadeite, Taaffeite","Painite"
"Which of the following disease is spread by Fleas?","Small pox, Tetnus, Yellow fever","Typhus"
"A dolphin perceives its environment by the sense of__________?","Sight, Sound, None of these","Both of these"
