question,wrong_choices,correct_answer
"Zaboor is revealed in ___________ language?","Hebrew, Arabic, Farsi","Siriac"
"Surah Muzammil means ____________?","Cover, In The Sky, Iron","Wrapped in Garments"
"Surah Ankaboot means ___________?","Cat, Cockroach, Horse","Spider"
"The major part of Holy Quran is revealed at _________ time?","Day, Both A & B, None of these","Night"
"Nemaz e taraweeh is?","wajib, farz, None of them","sunnat"
"Prophet hazrat __________ (AS) known as Shaikh al Anbiya ?","Essa (عليهم السلام), Musa (عليهم السلام), Haroon (عليهم السلام)","Noah (عليهم السلام)"
"Who is known as Adam-e-Sani?","Hazrat Adam (S), Hzarat Moosa (S), Hazrat Ibbrahim (s)","Hazrat Nooh (S)"
"Doors of Hell are ____________?","05, 06, 08","07"
"Jibrael came _________ times into the court of the Holy Prophet?","20000, 22000, 26000","24000"
"_____________ died while standing with the support of a stick?","Hazrat Musa, S, Hazrat Haroon","Hazrat Suleman S"
"When did incident of Karbala occur?","12 October 680, 14 October 680, 16 October 680","10 October 680"
"How many Surah are with name of Prophets?","2, 3, 5","6"
"Which of the following was the Teacher of Hazrat Musa (AS) ?","Hazrat Ishaq (AS), Hazrat Ibrahim(S), Hazrat Yousaf (S)","HAZRAT KHIZAR (S)"
"In which Islamic Battle Angeles helped the Muslims?","Uhad, Khyber, None","Badar"
"Who was called as kidnapper of the scholars?","Haroon-ur- Rasheed, Abu-Jafar al-Mansoor, None of the above","Mahmood Ghaznavi"
"Hazrat Adam (AS) is a word of______________language?","Syriani, Persian, Arabic","Hebrew"
"Name the Ummul-Mumineen who have narrated about 2210 Hadith of the Prophet (pbuh)?","Hazrat Hifsa (), Hazrat Khadijah (Radi-Allahu Anha), Hazrat Zainib (Radi-Allahu Anha)","Hazrat Aisha Siddiqa (Radi-Allahu Anha)"
"Who was the First Women “Hafiz e Quran” to memorize the Holy Quran?","Umal Mumneen Hazrat Aysha (R.A), Umal Mumneen Hazrat Zainab (R.A), None of them","Umal Mumneen Hafsah bint-e-Umar (R.A)"
"In which Hajjri Ghazwa e Ohad was fought?","2 AH, 4 AH, 5 AH","3 AH"
"When was the meat of donkey prohibited?","Jang-e-Badar, Jang-e-Ahzab, Jang-e-Hunain","Jang-e-Khaibar"
"Hazrat Yousaf (AS) remained in the well for__________ days?","5 days, 7 days, 12 days","3 days"
"How many years did it take for the complete revelation of the Quran?","12, 21, 22","23"
"The Gap between first and second Wahi was __________months?","2 Years 1 month, 2 Years 3 months, none of the above","2 Years 6 months"
"Hazrat Fatima (R.A) is known as____________?","Khatoon e Jannat., Khatoon e Mehshar., Khatoon e Madin","both and"
"The order of appearance of Surah Al-Kahf in the Holy Quran is___________?","16, 20, 37","18"
"Hazrat Ali (R.A) wife was?","Ruqayyah (R.A), Umm Kulthum (R.A), Hazrat Aisha (R.A)","Fatima-tul-Zahra (R.A)"
"The Pre-Islamic era is known as_________?","Modern age, Golden age, none","Age of ignorance"
"_________ is known as “Saloos ul Quran”?","Surah Kausar, Surah Nasar, Surah Fateha","Surah Ikhlas"
"Ghaseel ul Malaika is the title of____________?","Hazrat Abu Talha (R.A), Hazrat Abu Dahana (R.A), Hazrat Saad (R.A)","Hazrat Hanzala (R.A)"
"Which Surah of the Quran has the name “Allah” in every single verse?","Surah Muhammad [47], Surah Al-Ikhlas [112], Surah Al-Fatihah [1]","Surah Al-Mujadila [58]"
"Which prayer is not obligatory for women?","Maghrib prayer, Isha prayer, Fajir prayer","Juma prayer"
"What was the original color of Hajr-e-Aswad?","Black, Grey, Purple","White"
"The first Msjid (Mosque) that was built by the Holy Prophet (SAW) was_____________?","Masjid-ul-Haram, Masjid-e-Aqsa, Masjid-e-Nabavi","Masjid e Quba"
"What is the punishment of drinking wines in Quran?","40 Lashes, 50 Lashes, 80 Lashes","None of these"
"Hazrat Asma (RA), the daughter of Hazrat Abu Bakr (RA), got married to _________?","Hazrat Ubaidah (RA), Hazrat Abdur Rehman (RA), None of these","Hazrat Zubair Ibn al-Awam(RA)"
"The first complete Madani Surah is __________?","Al-Nas, Al-Nisa, Aal-e-Imran","Al-Baqarah"
"___________was the hardest form of revelation?","In form of Dreams, Behind the Curtain, None of these","Ringing Bells"
"The first poet of Islam is _______________?","Hazrat Zaid bin Harith (RA), Hazrat Ubaidullah (RA), None of these","Hazrat Hasaan ibn e sabit (R.A)"
"_________ was an eloquent speaker?","Hazrat Idrees (AS), Hazrat Musa (AS), Hazrat Ayub (AS)","Hazrat Haroon (AS)"
"Give the fundamental beliefs of Islam in the proper order ?","Tauheed, Risalat, Alhami Kutub, Akhirat and Malaika, Tauheed, Alhami Kutub, Risalat, and Malaika, Tauheed, Milka,Risalat, Alhami Kutub and Akhirat","Tauheed, Risalat, Malaika, Alhami Kutub and Akhirat"
"The Word “ALLAH” is mostly used in which Surah of the Holy Quran?","Al-Imran, Al-Ahzab, Al-Muzamil","Al-Mujadalla"
"Treaty of Hudaybiyyah (صلح الحديبية) took place in March 628____________.","shaban 6 AH, RAJAB 6 AH, RAMAZAN 6 AH","Dhu al-Qi’dah, 6 AH"
"The reward of which prayer is equal to the reward of Hajj or Umrah ?","Namaz-e-Khasoof, Namaz-e-Janaza, Namaz-e-Istasqa","Namaz-i-Ishraq"
"Battle in which Holy prophet(PBUH) not participated is known as_____________?","Sayee, Jaziya, Al-Fay","Sariyya"
"Which Prophet earned his living by making wallets?","Hazrat Dawood (AS), Hazrat Hood (AS), Hazrat Yahya (AS)","Hazrat Suilaiman (AS)"
"At the time of the death of Prophet Muhammed (Sallallahu Alaihi Wasallam) how many Huffaz were there?","35, 52, 30","22"
"How many times has the Qur’an emphasized on alms or charity?","140 times, 160 times, 170 times","150 times"
"Who was the first person who counted the Aayath (verses) of the Qur’an?","Hazart Fatma(RA), Hazart Abu Bakar (RA), Hazart Umer(RA)","Hazart Ayesha(RA)"
"In which year were the vowels inserted in the Qur’an?","42 Hijri, 41 Hijri, 40 Hijri","43 Hijri"
"What according to the Qur’an is the root cause of the evil?","Alcohol, Hypocrisy, Backbiting","Lying"
"What was the interval between the first and the second revelation of Holy Quran?","2 years and five months, 2 years and four months, 2 years and three months","2 years and six months"
"In which Surah the process for doing the woozu is mentioned?","Sura Esra, Sura Baqrah, Sura Mujadala","Sura Ma’edah"
"How many Surahs are in 30th Chapter (Parah) of Quran?","38, 39, 40","37"
"In which sura the regulation for prisoner of war is mentioned?","Sura Tauba, Sura Infall, Sure Naml","Sura Nes"
"How many Surahs names are with only one letter?","4, 5, 6","3"
"In which Surah the story of Karoon is mentioned?","Sura Maida, Sura Baraat, Sura Lael","Sura Qasas"
"In which Surah the name of Allah is repeated in every verse?","Sura Lael, Sura Al- Haj, Sura Hamzah","Surah Mujadala"
"Who was last Commander in chief of Ghzwa-e-mautah?","Abdur Rehman Bin Auf (R.A), Abdullah Bin Rawaha(R.A), None of above","Hazrat khalid bin waleed (R.A)"
"Zou-shadatian is title of ________________?","Hazrat Huzaifa Bin Yaman(R.A), Hazrat Ammar Bin Yasir (R.A), Hazrat Ahmed Bin Hanbal(R.A)","Hazrat Khuzima Bin Sabit (R.A)"
"Ozza was the name of___________?","Honour and respect, Name Of a tree, Name of snake","A specfic goddess of Quraish"
"What was made subservient to Hazrat Suliman (S)?","Fire, Water, Clay","Wind"
"How many time the word ‘Quran’ is repeated in Quran?","75, 55, 65","70"
"Name the battle which came to an end without result?","Hunain, Ohad, Mota","Tabook"
"Name the mountain where the Holy Prophet (S.W) deputed 50 skillful archers (Teer-Andaaz) in battle of Ohad?","Jabal-e-Safa, Jabel-e-Yahnene, Jabal-e-ohad","Jabal al-Rumah"
"Which Surah of Holy Quran has 200 VERSES ?","Surah Yusuf, SuraH Hamd, SuraH Noon","SuraH Al Imran"
"The last Sariya was fought in Syria in","9, H, 10","11 H"
"when the first Sariya was fought in Rabakh in_______________?","2, H, 3.","1. H"
"Quran is written in _______________?","Prose, Poetry, None of them","Prose & Poetry"
"Name the last Sariya____________ ?","Hazrat Ubaidah bin Haris (R.A), Hazrat Usamah bin Zaid (R.A), Hazrat Zaid bin Haris (R.A)","Hazrat Saad bin Abi Waqas (R.A)"
"Whom Arabs called ‘Saabi’_____________?","Those who worshiped moon, Those who worshiped idols, Those who worshiped sun","Those who worshiped stars"
"Name the prophet who was married to Rachel__________?","Hazrat Ishaq (S), Hazrat Younas (S), Hazrat Zakriya (S)","Hazrat Yaqoob (S)"
"The major part of Quran is revealed at ____________________?","Early morning, Noon, Early evening","Night time"
"Hazrat Umar Farooq was martyred on 1st Muharram_____________?","25, H., 26","24 H."
"Islamic official seal started in________________?","6, H, 8","7 H"
"How many disciples of Hazrat Essa (S) assisted him in preaching________?","6, 18, 24","12"
"Hazart Ali (R.A) married Hazart Fatma (R.A) in______________?","622, D, 623","624 D"
"Why Hazrat Ismaeel (S) divorced his first wife on the request of his father?","she was dishonest, she was disobedient, It is the order of Jibreal (S)","she was discourteous"
"Injeel means________________?","Light, Sign, Peace","Good news"
"Who was the first commander of islamic army?","Hazrat Umer (RA), Hazrat Khalid-bin-walid (RA), None of them","Hazrat Hamza (RA)"
"Who was chosen by hazrat Umar (R.A) to lead the Muslim Army in the battle of Qadsiya?","Hazrat Ubaida bin Jerrah, Hazrat Khalid bin Waleed(R.A), Hazrat Usama Bin Zaid (R.A)","Hazrat Saad bin Abi Waqas (R.A)"
"Torat means _____________?","Sign, Peace, Good news","Law"
"Zaboor means________________?","Law, Signs, Good news","Pieces"
"When for the first time Nimaz-e-kisoof was offered________________?","4, H, 6","5 H"
"In salat, saying Darood is_____________?","Farz, Mustahab, Wajib","Sunnah"
"At-least five wisk is weight of the produce of the crops over which Zakat becomes obligatory. Five wisk is equal to______?","45 Kg, 50 kg, 60 Kg","40 Kg"
"Who runs the accounts of central Zakat fund in Pakistan__________?","Auditor General, Accountant General, Minister of Religious Affairs","Administrator General"
"Which article of the constitution of 1973 is related to the affairs of Zakat______?","44, 46, 39","31"
"How many days are forbidden for Soam/Fasting throughout the year_________?","4, 6, 7","5"
"Aitekaaf (Seclusion) during the month of Ramzan is_____________?","Wajib, Mustahab, Nafl","Sunnah"
"Seclusion is Sunnah in the month of Ramzan. Another kind of Seclusion is Wajib its meaning is_______?","Imperative, Obligation, valid","Ordained"
"How many types of Tawaf are there_______________?","Two, Three, Four","seven"
"Tawaf-e-Rukan is _______________ component of Hajj?","Nafil, Wajib, Sunnat","Farz"
"Tawaf Al-Qudum is________________?","Nafil, Farz, Wajib","Sunnat"
"How many obligatory Acts of Hajj are there________?","Two, Four, Five","Three"
"Name the place which is called the Sacred Monument in the Holy Quran_________?","Mina, Arafat, Hateem","Muzdalfa"
"There are _______________ types of Hajj?","Two, Four, Five","Three"
"A person who has an intention to offer Umra and Hajj at Meeqat is called_______?","Mufrid, Mutamtae, None of them","Qaran"
"A person who has an intention to offer only Umra at Meeqat is called_______?","Qaran, Mufrid, None of them","Mutamtae"
"what do you understand by Tahleeq________?","First circle of Tawaf, Kalmaas in loud voice during Tawaf, Kissing of stone","Cutting of hair"
"What does mean by Hadi__________?","One kind of Hajj, Last pebble on throwing Iblees, Last circle of Tawaf","Animal to be sacrifice"
"A person who has an intention to offer only Hajj at Meeqat is called_______?","Qaran, MUtamtae, None of them","Mufrid"
"Maqbool Hajj means______________?","which is not accepted, which is observed correctly, which is performed with deficiencies","which is accepted"
"Mabroor Hajj means______________?","which is accepted, which is not accepted, which is performed with deficiencies","which is observed correctly"
"Name the term whose avoidance is rewarding and although doing it, is not a sin, yet it is a sort of vice?","Makruh-i-Tehrimi, Mubah, Mustahab","Makruh-i-Tanzihi"
"Name the term on which acting upon it is not rewarding but it is also not a sin if you do not act upon it what is about it?","Makruh-i-Tanzihi, Makruh-i-Tehrimi, Mustahab","Mubah"
"What an authentic Hadis is called___________?","Sahifah, Musnad, Saadiqah","Sahih"
"How many parts of each Hadis are there______________?","Three, Four, Five","Two"
"The parts of each of the Hadis are Sanad and_______________?","Musnad, Sahifah, Riwayat","Matan"
"How many types of Ijma are there____________?","four, Two, five","Three"
"Analogy is synonym of_____________?","Ijtehad, Ijma, Jury","Qiyas"
"Consensus of opinion stands for____________?","Ijtehad, Qiyas, Jury","Ijma"
"What is the literal meaning of Shariah__________?","Instructions to follow, Making a new laws, Making new Islamic system","A clear straight path"
"What is the meaning of Zarb-e-Azb?","Long Strike & Swift, Swift & Sharp Strike, Fast Strike & Sharp","Sharp & Cutting Strike"
"Hazrat Imam Tirmazy was a student of_____________?","Imam Bukhari, Bukhari Sharif,Ibne Dawood, Muta,Ibne Maja","Imam Abu Dawood"
"After sleeping for a 100 years, he again woke up:","Hazrat Musa (AS), Hazrat Salih (AS), None of above","Hazrat Uzair (AS)"
"Who is called as “Muslim Alexander”?","Khalid Bin Waleed (R.A), Sa’ad bin Abi Waqas (R.A), Amr bin Al-Aas (R.A)","Uqba bin Nafah (R.A)"
"Who was third Son in law of prophet?","Utbah ibn Abi Lahab, Usmaan ibn Affaan, Ali ibn Abi Taalib","Abu’l-Aas ibn al-Rabee"
"Mauwazatain mean________________?","A collection of Ahadith, A book of jafferi Fiqh, A book of Hanafi Fiqh","Two specific surah of Quran"
"In how many years Makki Surah were revealed?","14, 15, 16","13"
"The name of the sixth Kalimah is______________?","Kalimah Tamjeed, Kalimah Tauheed, Kalimah Shahadat","Kalimah Radd-i-Kufar"
"The name of the fifth Kalimah is ?","Kalimah Tamjeed, Kalimah Shahdat, Kalimah Tauheed","Kalimah Istighfar"
"The creation of heaven and earth is in which Surah ________?","Surah Yaseen, Surah rehman, Surah namal","Surah Al Al A’raf"
"There are 3 Farz, 10 sunnat and____________ wajibat in Hajj.","13, 11, 9","6"
"Total number of surah in quran are _______?","111, 110, 116","114"
"Which False Prophet Was Called The Liar’ By The Holy Prophet ?","Sajjah, Anwad Ansi, None Of Them","Musailama al Kazzab"
"First convert to Islam was a __________?","Boy, Slave, Companion","Lady"
"Qabeel & Habeel were the sons of which prophet?","Hazrat Nooh (AH), Hazrat Daud (AH), Hazrat Yaqoob (AH)","Hazrat Adam (AH)"
"Age of Hazrat Adam (S) at Sheesh’s (S) birth was _____________years?","100, 160, 190","130"
"Surah Baqarah contains ________verses?","284, 288, 290","286"
"Which prophet of Allah is called Abu Al-Bashar?","Hazrat Nooh (AH), Hazrat Ibrahim (AH), Hazrat Ayub (AH)","Hazrat Adam (AH)"
"Ayat ul Kursi (آیت الکُرسی) is in which Surah of the Holy Quran?","Surah Al-ma’ida, Surah An-Nisa, Surah Al- A’raf","Surah Al-Baqarah"
"Which surah of the Holy Quran ends with two prophets name?","Surah Yusuf, Surah Ibrahim, Surah Mujadila","Surah Al-A’la"
"Which surah of the Holy Quran starts with two fruits name?","Surah Imran, Surah An-Nisa, Surah Hud","Surah At-Teen"
"The Shortest Surah Al-Kawthar (الكوثر) has ______ verses?","2, 4, 5","3"
"_______ Surahs of the Holy Quran start with the word “Qul” (قُل).","4, 6, 7","5"
"How many surahs of the Holy Quran start with the word “Tabaraka” (تَبَارَکَ)?","1, 3, 4","2"
"How many prayers have no Azan (آذان)?","1, 3, None","2"
"What is the other name of Surah Fatiha?","Umm al-Quran, Umm al-Kitab, None of these","Both A & B"
"which one is called masha ,ar-ul-haram______________?","Mina valley, Arafat, Madina valley","Muzdalifa valley"
"surah namal means a_____________?","goat, Camel, Dog","Ant"
"who is the last ruler of Ummayed dynasty?","Hashim, Haroon, Mustanser Billa","Marwan"
"Who are not entitled to get Zakat?","Uncle, Sister, and Hisband, Brother, Nephew and children, Parents, brother and wife","Parents, Husband, wife and children"
"How many times word zakat is uesd in Makki surahs?","21, 19, 23","22"
"Hazrat Nooh (AH) name mentioned in the Holy Quran _____ times.","41, 42, 44","43"
"Hazrat Ibrahim (AH) had __________ sons.","1, 3, 4","2"
"_____________________ were the sons of Hazrat Ibrahim (AH).","Hazrat Ismail & Hazrat Haroon (AH), Hazrat Haroon & Hazrat Ishaq (AH), None","Hazrat Ismail & Hazrat Ishaq (AH)"
"The eldest daughter of our Holy prophet (SAW) was ______________.","Hazrat Ruqayah (RA), Hazrat Umme Kulsom (RA), Hazrat Fatima (RA)","Hazrat Zainab (RA)"
"First Azan was called out in_______ H.","3, H., 2","1 H."
"Who killed Muslema Kazab (Musailamah al Kazzab)?","Hazrat Ali (R.A), Hazrat Khalid Bin Waleed (R.A), None of these","Wahshi ibn Harb"
"For how many months Hazart Hasan (R.A) remained khalifa?","12, 13, 15","14"
"Our Holy Prophet Muhammad (SAW) had ___________ brothers & sisters.","1 brother & 1 sister, 1 brother & 2 sisters, 2 brothers & 1 sister","None"
"__________ city is called “home of hadith”.","Makkah, Baghdad, Basra","Madina"
"The first Kalima i.e (Kalima-e-Tayyab) consists of how many dots _____?","1, 2, 3","0"
"No of Kufars (Non Muslims Forces) in Battle of Badr were _________.","1100, 1200, 1300","1000"
"How many Muslims Martyred in Battle of Badr ?","7, 21, 28","14"
"_______ Kufars killed in Battle of Badr.","50, 120, 200","70"
"Which Angel will blow the trumpet (Sur) at the day of Judgment?","Hazrat Mika’il, Hazrat Jabra’il, None","Hazrat Israfil"
"How many times the trumpet will be blown by Hazrat Israfil?","One, Three, Four","Two"
"There are _________ farz in wuzoo (وضو).","3, 5, 6","4"
"There are _________ farz in Ghusal (غسل).","4, 5, 6","3"
"_________ is the best drink mentioned in Holy Qur’an.","Honey, Water, Juice","Milk"
"_________ is the best eatable thing mentioned in the Holy Qur’an.","Dabino, Water melon, Milk","Honey"
"The most disliked thing by Allah Ta’ala is ____________.","Murder, Backbiting, Marriage","E. Divorce"
"________ Sura of the Holy Qur’an is called the “mother of Qur’an”.","Baqara ￼, Iklass, Yaseen","Fatiha"
"The biggest animal mentioned in the Holy Qur’an is ____________.","Fish, Whale ￼, Anaconda","Elephant"
"The smallest animal mentioned in Holy Qur’an is _____________.","Ant, Spider, Fly","Mosquito￼"
"How many Surahs name is only one letter?","Two, Four, Five","Three￼"
"Jannat al-Baqi is located in ________.","Makkah, Baghdad, Palestine","Madina"
"In Surah ________, every verse ends with letter ‘Ra’.","Buruj, Dariq, Shams","Kausar"
"In Surah __________, every verse ends with letter ‘Dal’.","Iqra, Falaq, Balad","Ikhlas"
"27 attributes of Allah, mentioned in __________ Surah.","Yaseen, Ma’ida, Rahman","Hadeed"
"How many Surahs of the Holy Quran start with the word ‘Qad’ ?","1, 3, 4","2"
"The story of the worship of cow of Bani Israeel mentioned in Surah ____________.","Surah Baqara, Surah Qasas, Surah Kahfi","Surah Taha"
"_________ is the most disliked place by Allah Ta’al","Home, Shop, Mosque","Bazar"
"Which is the most liked place by Allah Ta’ala?","Home, Shop, Bazar","Mosque"
"The first daughter of our Holy prophet (SAW) was ______________.","Hazrat Ruqayah (RA), Hazrat Fatima (RA), Hazrat Umme Kulsom (RA)","Hazrat Zainab (RA)"
"The second daughter of our Holy prophet (SAW) was ______________.","Hazrat Zainab (RA), Hazrat Fatima (RA), Hazrat Umme Kulsom (RA)","Hazrat Ruqayah (RA)"
"The third daughter of our Holy prophet (SAW) was ______________.","Hazrat Zainab (RA), Hazrat Fatima (RA), Hazrat Ruqayah (RA)","Hazrat Umme Kulsom (RA)"
"The fourth daughter of our Holy prophet (SAW) was ______________.","Hazrat Zainab (RA), Hazrat Ruqayah (RA), Hazrat Umme Kulsom (RA)","Hazrat Fatima (RA)"
"Islamic calendar is also called _____________.","Muslim calendar, Hijri calendar, Lunar calendar","Above all"
"Makkah was also called___________?","Ummul Qura, Baladul Ameen, Bakkah","All of these"
"Which is first month of Islamic Calendar?","Rajab, Jamadi-ul-Awwal, Safar","Moharram"
"Which is second month of Islamic Calendar?","Rajab, Rabi-ul-Awwal, Rabi-us-Sani","Safar"
"Which is third month of Islamic Calendar?","Safar, Rajab, Jamadi-ul-Awwal","Rabi-ul-Awwal"
"Which is fourth month of Islamic Calendar?","Rajab, Rabi-ul-Awwal, Jamadi-us-Sani","Rabi-us-Sani"
"Which is fifth month of Islamic Calendar?","Moharram, Rajab, Safar","Jamadi-ul-Awwal"
"Which is sixth month of Islamic Calendar?","Rabi-us-Sani, Rajab, Rabi-ul-Awwal","Jamadi-us-Sani"
"Which is seven month of Islamic Calendar?","Jamadi-ul-Awwal, Rabi-ul-Awwal, Safar","Rajab"
"Which is eighth month of Islamic Calendar?","Ramzan, Rabi-ul-Awwal, Jamadi-us-Sani","Shaban"
"Which is ninth month of Islamic Calendar?","Shawwal, Rabi-ul-Awwal, Safar","Ramzan"
"Which is 10th month of Islamic Calendar?","Ramzan, Ziqaad, Zilhaj","Shawwal"
"Which is 11th month of Islamic Calendar?","Safar, Rabi-uI-Awwal, Shawwal","Ziqa’ad"
"Which is 12th month of Islamic Calendar?","Rabi-us-Sani, Rajab, Jamadi-us-Sani","Zilhaj"
"How many Surahs of the Holy Quran start with word ‘Inna‘ ?","Three, Five, Six","Four"
"Which is the best month mentioned in Holy Qur’an?","Rajab, Sha’abān, Hajj","Ramadan￼"
"Which is the best night mentioned in Holy Qur’an?","Shab-e-Bara’at, Shab-e-Miraj, None of these","Shab-e-Qadar"
"In how many years Makhi Surahs were revealed?","14, 15, 16","13"
"In how many years Madani Surahs were revealed?","8, 9, 11","10"
"In which Surah of the Holy Quran, the regulations for prisoners of war mentioned?","Baqara, Al- Imran, Insan","Nisa"
"which words of the Holy Quran are not explained by a common person?","Qamari, Shamsi, All of them","Muqte’aat"
"The literal meaning of Soam is ______.","To Leave Something, To Avoid Something, None of these","Both (a) & (b)"
"The Wahi was sent in the month of ______.","Shawal, Safar, None of These","Ramzan"
"The pre-requisite of fasting is______.","Self-discipline, Self-motivation, Self-determination","Self-control"
"Fasting was made obligatory in ______.","7th Shaban, 2, H, 8th Shaban, 2","10th Shaban,2 H"
"______ is called Shield against sins.","Salat, Zakat, Hajj","Fasting"
"______ is the atonement for breaking the fast.","To Feed 50 people, To Feed 70 people, To Feed 80 people","To Feed 60 people"
"Fasting demands total abstinence from ______.","Eating, Drinking, sex","E. All of these"
"Fasting is between Rozadar and ______.","Prophet, Angels, Jinns","Allah"
"The function of fasting is ______.","To Provide Comfort to the Society, To Help the poor, To create peace in the Society","To Make the Sacrifice of Body and Soul"
"Soam is prohibited at the time of ______.","Eid-ul-Fitr, Eid-ul-Azha, None of these","Both (a) & (b)"
"What is the meaning of E’tikaf?","Taharat, Purification, None of these","Seclusion"
"E’tikaf is ______ in the month of Ramzan.","Farz, wajib, None of these","Sunnah"
"______ is the month of purity.","Zil-Hajj, Shawal, None of these","Ramazan"
"What does Taraweeh means?","To Stand, To sit, None of these","To Rest"
"______ is the most important night in the month of Ramzan.","Shab-e-Bara’at, Shab-e-Miraj, None of these","Shab-e-Qadar"
"The first Ashra of Ramazan is called ______.","Ashra-e-Najat-e-Naar-e-Jahannum, Ashra-e-Maghfirat, All of these","Ashra-e-Rehmat"
"The second Ashra of Ramazan is called ?","Ashra-e-Rehmat, Ashra-e-Najat-e-Naar-e-Jahannum, All of these","Ashra-e-Maghfirat"
"The third Ashra of Ramazan is called ?","Ashra-e-Rehmat, Ashra-e-Maghfirat, None of these","Ashra-e-Najat-e-Naar-e-Jahannum"
"Which Ayat of Surah Al-Baqarah describes the obligation of soam?","80, 81, 82","183"
"When the month of Ramazan comes, the doors of the Heaven are opened and the doors of hell are close”It is______.","Quranic Ayat, Both (a) & (b), None of these","Hadith"
"How many types of fast a Muslim keeps?","1, 2, 4","3"
"______ days are prohibited for fasting throughout the Year.","1, 3, 4","5"
"Which night is better than thousand nights?","Lailat-ul-Bara’at, Lailat-ul-Miraj, None of these","Lailat-ul-Qadar"
"How many fasts Hazrat Isa (AS) Kept in desert and advised his followers to follow it?","10, 20, 30","40"
"Who was the first Caliph?","Hazrat Umar(R.), Hazrat Ali(R.), Hazrat Usman(R.)","Hazrat Abu Bakar(R.)"
"Who was the second Caliph?","Hazrat Ali(R.), Hazrat Usman(R.), Hazrat Abu Bakar(R.)","Hazrat Umar(R.)"
"Who was the Third Caliph?","Hazrat Umar(R.), Hazrat Ali(R.), Hazrat Abu Bakar(R.)","Hazrat Usman(R.)"
"Who was the fourth Caliph?","Hazrat Umar(R.), Hazrat Usman(R.), Hazrat Abu Bakar(R.)","Hazrat Ali(R.)"
"__________ month is known as Sayeed us Shahoor.","Rajab, Sha’ban, Zil-Haj","Ramazan"
"The kaffarah for breaking fast is to keep ______ fast for continuous days.","30, 40, 50","60"
"Which Sura is considered as 1/3 of the Holy Qur’an?","Falaq, Nass., Fatiha","Al-Ikhlas"
"Which Surah is considered as 1/4 of the Holy Qur’an?","Al-Ikhlas, Falaq, Nass","Kafiron"
"Which Surah of the Holy Quran was revealed twice?","Ikhlaas ￼, Nooh, Tauba","Fatiha"
"Who was the first son of Hazrat Muhammad (SAW)?","Hazrat Ibrahim, Hazrat Abdullah, Hazrat Abdurrehman","Hazrat Al-Qasim"
"Who was the second son of Hazrat Muhammad (SAW)?","Hazrat Al-Qasim, Hazrat Ibrahim, Hazrat Abdurrehman","Hazrat Abdullah"
"Who was the third son of Hazrat Muhammad (SAW)?","Hazrat Abdullah, Hazrat Al-Qasim, Hazrat Abdurrehman","Hazrat Ibrahim"
"How many sons Hazrat Muhammad (SAW) had with Hazrat Khadija (RA)?","1, 3, 4","2"
"Hazrat Ibrahim was the son of Hazrat Muhammad (SAW) and _________________.","Zaynab bint Khuzayma, Rayhana bint Zayd, Aisha Abi Bakr","Maria al-Qibtiyya"
"Hazrat Qasim was the son of Hazrat Muhammad (SAW) and _________________.","Zaynab bint Khuzayma, Rayhana bint Zayd, Maria al-Qibtiyya","Hazrat Khadija"
"Hazrat Abdullah was the son of Hazrat Muhammad (SAW) and ____________.","Zaynab bint Khuzayma, Rayhana bint Zayd, Maria al-Qibtiyya","Hazrat Khadija"
